assessmentId,internalTaxonId,scientificName,redlistCategory,redlistCriteria,yearPublished,assessmentDate,criteriaVersion,language,rationale,habitat,threats,population,populationTrend,range,useTrade,systems,conservationActions,realm,yearLastSeen,possiblyExtinct,possiblyExtinctInTheWild,scopes
67372241,37598,Nesiota elliptica,Extinct,,2016,2015-06-13 00:00:00 UTC,3.1,English,The St Helena Olive<em> </em>(<em>Nesiota elliptica</em>) is almost certainly Extinct. The population was extremely small for at least 120 years before the final tree died in 1994. Well under 1 km<sup>2</sup> of suitable habitat remains along St Helena’s Central Ridge and this has been searched extensively by botanists over recent decades.,"<p>Based on existing evidence, it appears that this species was an inhabitant of cloud forest around St Helena’s highest altitudes (above 750 m). The 20<sup>th</sup> Century specimen at Mt Actaeon grew in Tree Fern thicket (Cronk 2002), but it is also likely to have occurred in more mixed vegetation with other upland trees on steep slopes below the ridge crest. As the high altitude zone comprises the last vestiges of native forest on St Helena, there remains a possibility that the final individuals were relicts along the upper altitudinal edge of the former range and that the natural distribution would have extended to lower altitudes. However, the Olive certainly seemed to be a regular cloud forest species and a more natural member of this community than other postulated ‘transitional zone’ trees such as Redwood (<em>Trochetiopsis erythroxylon</em> (G.Forst.) Marais) and She Cabbage (<em>Lachanodes arborea</em> (Roxb.) B.Nord.).<br/><br/>The flowering period was variable but was probably mainly restricted to the winter months. The small blooms were mainly pollinated by hoverflies, and matured into dry capsules which took up to a year to ripen (Jackson 1991).</p>","<p>The majority of the population was probably lost to deforestation following the establishment of a permanent colony on St Helena by the East India Company in 1658. Trees were cleared for pasture land and also to provide fuel and timber, for which the hard, yellow wood was probably reasonably prized. Only fragments of the original mid-altitude forest cover remained by the mid 18<sup>th</sup> Century, and by the time of Melliss’s records in the late 1800s there was little native vegetation away from the highest elevations. Further extensive damage was inflicted in the 20<sup>th</sup> Century when large plantations of New Zealand flax (<em>Phormium tenax</em> J.R.Forst. &amp; G.Forst.) were established over the steep slopes of the Central Ridge, although it appears that the species was already close to extinction by this time.<br/><br/>Once severely reduced in numbers, small population size appears to have created further, inherent problems through low self-compatibility and perhaps also through inbreeding depression which may have reduced resilience to pests. It is entirely possible that susceptibility to introduced fungal pathogens may have played a longer term role in the overall demise.</p>","<p>Intact fragments of St Helena Olive habitat probably persisted until the late 1800s, when Solander noted trees up to 30 foot high (approx. 9 m) (see Cronk 2002). A century later, only 12-15 trees remained, and these reputedly attained little more than half the former stature (Melliss 1875). When George Benjamin discovered a single specimen near Mt Actaeon* in 1977 the species had not been seen for many years. This proved to be the last known wild specimen in existence. It died in 1994 but seedlings and a cutting had been propagated from it, and a few cultivated individuals continued the line. Unfortunately these did not survive long, the last succumbing to fungal infections in 2003.<br/><br/>(*There is some controversy of the naming of the three summits in the Diana’s Peak range. We here refer to Mt Actaeon as the most northerly in the series.)</p>",,"The St Helena Olive formerly occurred in the uplands of St Helena, South Atlantic Ocean.&#160;So few specimens survived to the historical period that the original range is difficult to reconstruct. Nearly all old records are from the Diana’s Peak area, although Roxburgh also noted it from “the Sandy Bay range” (see Beatson 1816), presumably meaning that it was more widely distributed along the Central Ridge.","The wood was undoubtedly used for timber, but the harvest is unlikely to have been regular since the mid 19th Century as specimens have become increasingly scarce.",Terrestrial,"After the rediscovery of the single tree in 1977, an intensive rescue attempt was mounted in with expert help from the Royal Botanic Gardens, Kew (Jackson 1991). They found that the species possessed a self-incompatibility breeding system resulting in less than 1% fertility. It consequently proved difficult to raise seedlings, and only one out of hundreds of cuttings was successful. Fungal infections killed the wild tree and blighted attempts to rear plants in cultivation, eventually leading to the death of the last daughter individual.",Afrotropical,2003,false,false,Global
67379134,67379124,Heliotropium pannifolium,Extinct,,2016,2015-06-13 00:00:00 UTC,3.1,English,There is little room for doubt that the St Helena Heliotrope (<em>Heliotropium pannifolium</em>) is extinct. It has not been seen for over 200 years and the likely habitat areas have either been searched intensively or overgrown by dense vegetation.,"No detailed information is available on this species, which was clearly already on the verge of extinction by the time it was discovered by Burchell in 1810. Broad Gut lies close to sea level and much of the area today is dominated by arid, rocky desert. There is a temporary stream along the base which provides some areas of wetland. The more humid upper parts of the valley are now densely vegetated with non-native forest, but some evidence suggests that they were formerly&#160; open and managed, perhaps for livestock. Since there is no indication of precisely where the collection was made, the exact habitat cannot be identified with certainty.","It is likely that St Helena Heliotrope was eradicated primarily as a result of goat grazing (<em>Capra hircus</em>). Goats were introduced to St Helena by Portuguese sailors in the early 16<sup>th</sup> Century and prospered in large numbers across the lowlands, causing large-scale damage to the original native vegetation. Much of the Sandy Bay basin, through which Broad Gut runs, was heavily degraded by the time the species was discovered in the early 1800s.",No information survives regarding the past population.,,"St Helena Heliotrope was formerly known from the coastal lowlands of St Helena, South Atlantic Ocean.&#160;The species is known&#160;only&#160;from a single collection, made in Broad Gut in 1810 by W.J. Burchell. It has not been seen since.",,Terrestrial,,Afrotropical,1810,false,false,Global
69555490,22693621,Haematopus meadewaldoi,Extinct,,2015,2015-03-31 00:00:00 UTC,3.1,English,"<strong>European regional assessment: Extinct (EX)</strong><strong><br/></strong><strong>EU27 regional assessment: Extinct (EX)</strong><br/><br/>This species was found in the eastern Canary Islands, but is now Extinct due to overharvesting of its invertebrate prey. It was last collected in 1913, and locally reported to be absent by the 1940s.","It inhabited the coastal zone and most likely favoured rocky and sandy shores. Very little is known of its breeding habits. A female ""soon to lay"" was collected in southern Fuerteventura in early April 1888, and a pair in breeding condition collected on Graciosa in early April 1890. The nest and eggs are undescribed. It diet is unknown but likely was predominantly mussels and limpets. The species is thought to have been resident (Hockey 1996).","Its decline was probably a result of overharvesting of intertidal invertebrates and disturbance by people (Hockey 1987), although predation by rats and cats has also been implicated (Collar and Stuart 1985).",The European and EU27 population is estimated to be extinct.,,"The species was endemic to Fuerteventura, Lanzarote and their offshore islets in the Canary Islands, Spain (Collar et al. 1994). It was last collected in 1913 and locally reported to have become extinct by the 1940s (Collar and Stuart 1985). It is now considered extinct because extensive surveys in the mid-1980s failed to find any evidence of the species's survival, despite four convincing reports (two from Tenerife and two from Senegal) between 1968 and 1981 (Collar et al. 1994).",,Terrestrial|Marine,<strong>Conservation Actions Underway</strong><br/>None<br/><br/><strong>Conservation Actions Proposed</strong><br/>No conservation measures are needed.,Palearctic,1950,false,false,Europe
78430385,19476,Rheobatrachus vitellinus,Extinct,,2022,2021-02-03 00:00:00 UTC,3.1,English,"Listed as Extinct because it has not been recorded in the wild since 1985, and extensive searches over the last 35 years have failed to locate this species. This species experienced a very rapid decline, from being common to extinct in less than a year, most likely due to chytridiomycosis.","This was a mostly aquatic species largely restricted to the shallow section of fast-flowing creeks and streams in rainforest. It was only recorded from pristine rainforest where there was no disturbance. Males would call in summer along the edge of creeks and streams. It was one of only two known species to brood its offspring within its stomach. Females deposited their eggs, and then swallowed them. While in the stomach, tadpoles excreted some form of enzyme that inhibited the female's gastric digestion, and then proceeded to develop into fully formed froglets. The froglets were then regurgitated through the female's mouth.","The cause(s) of the population decline remain unknown. McDonald (1990) found no obvious evidence that seasonal rarity, over-collecting, predation, drought, floods, habitat destruction, disease, heavy parasite loads or stress due to handling for data collection were responsible for the population declines. Threats to the Eungella National Park include fires that might sweep up the slopes of the mountain during harvesting of the sugar cane in the fields below (Winter and McDonald 1986). Successive fires extend deeper into the rainforest leaving grassy ridges that are devoid of trees (Winter and McDonald 1986). The rainforest is extremely narrow in places and continual fire might eventually erode away entire sections of the forest or fragment the forest (Winter and McDonald 1986). Weeds that encroach on the edges of the forest pose a similar threat (Winter and McDonald 1986). It was thought that it might have been possible that the decline that was observed in 1984–1985 was a natural population fluctuation and that residual individuals had retreated to hidden refuges (Winter and McDonald 1986; McDonald 1990). The extent of such population fluctuations is unknown, but there is evidence of large swings in numbers of other Australian frogs (McDonald 1990). However, despite continued efforts to locate the species, it has not been recorded within Eungella National Park or any other locations since March 1985 (Ingram and McDonald 1993; Richards, McDonald and Alford 1993; Hero <em>et al.</em> 1998, 2002; McDonald and Alford 1999). Eungella National Park is subject to weed invasion on the edges of the reserve (Winter and McDonald 1986).&#160;<br/><br/>From what is known from similar declines and disappearance elsewhere in the world, chytridiomycosis (present in at least some rainforest streams at Eungella) must be suspected as the most likely cause of the extinction of this species. The Eungella Torrent Frog (<em>Taudactylus eugellensis</em>), which inhabited the same streams, was actively preyed upon by&#160;<em>Rhobatrachus vitellinus</em>&#160;(Winter and McDonald 1986) and suffered a steep population decline around the same time as&#160;<em>R. vitellinus</em>&#160;was discovered to have traces of infection from the chytrid fungus (McDonald 1990, Rettalick <em>et al.</em>&#160;2004).<em>&#160;Taudactylus eugellensis&#160;</em>has been implicated as a host and reservoir for the chytrid fungus (Rettalick <em>et al. </em>2004) so it is therefore very likely that transmission of the fungus occurred between these species.","The species was considered common across its range until January 1985 when the first signs of decline (reported by Winter and McDonald 1986) were observed at lower altitudes (about 400 m asl) (McDonald 1990). At higher altitudes the frogs remained common until March 1985, but were absent in June of that year (McDonald 1990). Despite continued efforts to locate the species, it has not been recorded again within Eungella National Park or any other locations (Ingram and McDonald 1993, McDonald and Alford 1999, Meyer <em>et al. </em>2020). Most recently, between 2000–2015 surveys targeting this species and other endemics in the region at 114 sites within Eungella National Park and adjoining State Forest found no trace of the species. This species is considered to be extinct.",,"This Australian endemic species was discovered in January 1984 (Mahony <em>et al.</em> 1984) and was found exclusively in undisturbed rainforest in Eungella National Park, mid-eastern Queensland at altitudes of 400–1,000 m asl (Covacevich and McDonald 1993). The extent of occurrence (EOO) of the species was less than 150 km<sup>2</sup>&#160;as calculated using the localities in McDonald (1990).",There was no use or trade of this species.,Terrestrial|Freshwater (=Inland waters),<strong><em>Conservation Actions In-Place</em></strong><br/>Its known range was within Eungella National Park. A recovery plan for the species has been prepared. It is listed in CITES Appendix II.,Australasian,March 1985,false,false,Global
78430533,19475,Rheobatrachus silus,Extinct,,2022,2021-02-03 00:00:00 UTC,3.1,English,"Listed as Extinct because it has not been recorded in the wild since 1981 and the last individual in a laboratory died in 1983. This species experienced a very rapid decline in the wild, from being common to extinct in just a few years, most likely due to chytridiomycosis. Extensive searches in the following 25 years failed to locate this species. There are fewer targeted searches for this species now that considerable time has passed since an individual was last seen in the wild.","This species lived in rainforest, wet sclerophyll forest and riverine gallery open forest at 350 m asl and was closely associated with watercourses and adjacent rock pools and soaks (Czechura 1991, Meyer <em>et al.</em> 2001). These streams are mostly perennial, but in extremely dry years they may cease to flow (Ingram 1983). The vegetation along the stream banks is usually closed forest or tall closed forest with emergent eucalypts, although there are some sites in open forest with grassy ground cover (Ingram 1983). In spring and summer individuals were usually found in or at the edge of rock pools, either amongst leaf-litter, under and between stones or in crevices around the edge (Ingram 1983). The species was also found under rock in shallow water in backwaters and also the main flow of permanent watercourses (Ingram 1983, Czechura 1991). <br/><br/>Searches of popular sites in winter only recovered two frogs and it is assumed that the species hibernated in deep crevices in rocks or spaces between rocks underwater during the colder months (Ingram 1983). Adult males tended to prefer deeper pools, whereas females and juveniles may have moved to newly created pools after rain as long as these pools contained stones and/or leaf-litter (Ingram 1983). The prerequisite for the use of pools by this species seemed to be that the pool must be deep enough for the frog to be able to sit with its head out of the water and be able to safely submerge (Ingram 1983). Individuals would only sit fully exposed on the rocks during light rain (Ingram 1983). The species&#160;was never recorded from cleared riparian habitat.<br/><br/>Breeding activity occurred between October and December (Ingram 1983). Males called from rock crevices above pools (Ingram 1983). Females brood young within their stomach and gave birth through the mouth (Tyler and Carter 1982). Fertilized eggs or early stage larvae were presumably swallowed by the female and completed their development in the stomach (Tyler and Carter 1982). The number of eggs in gravid females (approximately 40) exceeded the number of juveniles found to occur in the stomach (21–26) (Tyler 1989). It is not known whether or not the excess eggs were digested by the female or whether or not they were simply not swallowed (Tyler 1989). The production of hydrochloric acid in the stomach of the female ceased during brooding (Tyler <em>et al.</em> 1983). Tadpoles developed in a manner similar to the aquatic tadpoles of other species though, as they fed off egg yolk, the labial teeth were absent and the intestines formed at a later stage of development (Tyler 1989). After 6–7 weeks the females gave birth to up to 25 young (Tyler and Davies 1983a). Young emerged from the female’s mouth as fully formed frogs and after four days the digestive tract returned to normal and the female recommenced feeding (Tyler and Davies 1983b). Ingram (1983) reported minimum brooding periods from two individuals of 36 and 43 days and suggested that the duration was such that females were unlikely to breed twice in one season.","The reason(s) for the disappearance of this species remains unknown (Tyler and Davies 1985). Populations were present in logged catchments between 1972 and 1979. Although the species persisted in the streams during these activities, the effects of timber harvesting on this aquatic species were never investigated. Its habitat is currently threatened by feral pigs, invasion of weeds (especially Mistflower <em>Ageratina riparia</em>), and altered flow and water quality due to upstream disturbances (Hines <em>et al. </em>1999). However, from what is known from similar declines and disappearances elsewhere in the world, the disease chytridiomycosis must be suspected.","When first discovered, this species was extremely abundant and common. The species declined rapidly and disappeared at about the same time as a sympatric species <em>Taudactylus diurnus</em> (Czechura and Ingram 1990). Czechura and Ingram (1990) and Ingram (1990) state that the last frog was seen in the wild in 1979 on the Conondale Range. However, Richards <em>et al.</em> (1993) reported the existence of a specimen taken from the Blackall Range in September 1981. Despite intensive searching, the species has not been located since (Ingram and McDonald 1993, Hines <em>et al.</em> 1999). In the laboratory, the last known individual died in November 1983 (Tyler and Davies 1985b). Ingram (1983) studied a population of the species in the headwaters of Booloumba Creek, Conondale Range, and estimated that approximately 78 were present in 1976. No other estimates of population size are available for the species. This species is believed to be extinct.",,"This Australian endemic species was restricted to elevations between 350 and 800 m asl in the Blackall and Conondale Ranges in southeast Queensland (Hines <em>et al</em>. 1999) with a geographic distribution of less than 1,400 km<sup>2</sup> (map in Hines<em> et al</em>. 1999). It&#160;inhabited streams in the catchments of the Mary, Stanley and Mooloolah River (Ingram 1983). It was thought to have been first found in 1972 (Liem 1973), but Ingram (1991) reported a specimen collected in 1914 from the Blackall Range.",This species was the subject of research in to its unique breeding ecology. There was no trade of this species.,Terrestrial|Freshwater (=Inland waters),"<strong><em>Conservation Actions In-Place</em></strong><br/>The historical range of the species included included&#160;Kondalilla National Park, Conondale National Park, Sunday Creek, State Forest 311, Kenilworth State Forest and private land adjacent to these areas (Hines <em>et al. </em>1999). It is listed in CITES Appendix II.",Australasian,1981,false,false,Global
78434814,12149,Litoria nyakalensis,Extinct,,2022,2021-02-03 00:00:00 UTC,3.1,English,"Listed as Extinct because it has not been recorded since 1990, and extensive searches over more than 20 years have failed to locate any individuals of this species. This species experienced very rapid declines, from being relatively common to extinct at each known locality within just a year or so, most likely due to chytridiomycosis.","This species was a rainforest specialist, endemic to the Wet Tropics Bioregion (Williams and Hero 1998, 2001), and found in upland rainforest and wet sclerophyll forest along fast-flowing streams where there is white water from riffles and cascades (Liem 1974, McDonald 1992). It was usually found perched on rocks or overhanging vegetation adjacent to the water (Liem 1974). Little is known about the life history of this species. Mating calls were heard from October to March (Liem 1974). From 86–90 large unpigmented eggs (1.9–2.5mm diameter) were laid under rocks in riffles (Richards 1993, Hero and Fickling 1996). Richards (1992) described the tadpole and noted that it was one of the few species of tadpole known to exhibit adaptations to torrent environments of Australia, including a streamlined body shape, large suctorial mouthparts and muscular tail. Tadpoles commonly overwintered in upland streams, although those hatching in early summer could metamorphose before the next autumn (Richards 1992).","This species is one of seven frogs occurring in upland rainforest streams in northeastern Queensland that experienced substantial range contractions and population declines between 1988 and late 1994 (Ingram and McDonald 1993, Richards <em>et al.</em> 1993, Northern Queensland Threatened Frogs Recovery Team 2001). These species share the common characteristics of having a high degree of habitat specialisation, and reproduction in fast flowing streams (Williams and Hero 1998). The declines are believed to be caused by the amphibian chytrid fungus (<em>Batrachochytrium dendrobatidis</em>) (Northern Queensland Threatened Frogs Recovery Team 2001) although dead or dying individuals of this species specifically were not found (Berger <em>et al. </em>1999).<br/><br/>Richard <em>et al.</em> (1993) rejected drought, floods, habitat destruction, or pollution by pesticides, inorganic ions or heavy metals as possible causes of the decline. The habitat of the species in the Wet Tropics has been protected since 1988; therefore, habitat destruction as a result of logging was no longer a threat (McDonald and Alford 1999). Feral pigs were a potential cause of riparian habitat damage and adult frog mortality (Richards <em>et al.</em> 1993). The activity of feral pigs has been recorded to have increased over the period 1989–1992 in an area previously inhabited by this species (Richards <em>et al.</em> 1993).","This species was once moderately common in suitable habitat, but then experienced a catastrophic decline. Adults were last recorded in April 1990, and tadpoles and metamorphs were last recorded in November 1990 on the Carbine Tableland (Richards <em>et al.</em> 1993). However, this species had apparently disappeared from sites on the Atherton Tableland much earlier (Richards <em>et al.</em> 1993). It was recorded from various sites on the Atherton Tableland prior to 1973 (Liem 1974), but was not encountered in Danbulla State Forest during 1989–1992 or at any Atherton Tableland site during surveys conducted between 1991 and 1992 (Richards <em>et al.</em> 1993). Surveys in the Wet Tropics conducted in 1991−1992, 1993 and 2011−2013 failed to locate the species from a number of historic locations and other potentially suitable habitat (Ingram and McDonald 1993, Richards <em>et al. </em>1993, Trenerry <em>et al.</em> 1994, Hoskin and Puschendorf 2014), and Hoskin and Puschendorf (2014) concluded that the Mountain Mistfrog could be considered extinct. The Conservation Advice published for this species summarises the extensive survey efforts from 1989 to 2013 that were unsuccessful in locating any extant populations (Threatened Species Scientific Committee 2019). Gillespie<em> et al.</em> (2020) have now declared this species extinct.",,"This Australian endemic species was distributed across two thirds of the Wet Tropics from Douglas Creek near Cardwell to Alexandra Creek, Thornton Peak in northeast Queensland (Hero and Fickling 1994) at altitudes between 380 and 1,020 m asl (McDonald 1992).",There was no use or trade of this species.,Terrestrial|Freshwater (=Inland waters),"<strong><em>Conservation Actions In-Place</em></strong><br/>The habitat of the species in the Wet Tropics has been protected since 1988. Historically it was&#160;known from Wooroonooran, Daintree, Crater Lakes, Crater and Palmerston National Parks, Mt Lewis, Maalan, Ravenshoe, Herberton Range, and Kirrama State Forests, and SF758 Alcock, Daintree Timber Reserve (165 Monkhouse) (Tyler 1997). A recovery plan for the Mountain Mistfrog was developed in 2001 by the Northern Queensland Threatened Frogs Recovery Team (2001).",Australasian,1990,false,false,Global
