assessmentId,internalTaxonId,scientificName,redlistCategory,redlistCriteria,yearPublished,assessmentDate,criteriaVersion,language,rationale,habitat,threats,population,populationTrend,range,useTrade,systems,conservationActions,realm,yearLastSeen,possiblyExtinct,possiblyExtinctInTheWild,scopes
184207893,44080,Brighamia insignis,Extinct in the Wild,,2023,2022-08-30 00:00:00 UTC,3.1,English,"<p><em>Brighamia insignis</em> is assessed as Extinct in the Wild under criterion D. NTBG Senior Research Biologist Ken Wood saw the last remaining wild individual in Hoʻolulu Valley on the Nā Pali coast of Kauaʻi by helicopter on 29 August 2012. On 24 June 2019 and 20 May 2020, drone survey work was conducted in that same location and surrounding area which confirmed that last known wild individual is no longer present.</p>","<p>The taxon is a succulent, typically unbranched shrub historically endemic to the westernmost main Hawaiian Islands of Kaua‘i and Ni‘ihau where it occurred on sea cliffs and coastal bluffs between sea level and 400 m elevation. Associated native plant species included <em>Artemisia australis</em>, <em>Bidens forbesii</em>, <em>Eragrostis variabilis</em>, <em>Euphorbia</em> spp., <em>Hibiscus kokio</em> subsp. <em>saintjohnianus</em>, <em>Pandanus tectorius</em>, <em>Polyscias racemosa</em>, and <em>Psydrax odorata</em>.</p>","<p>Major threats that contributed to the decline of this taxon in the wild included predation and habitat degradation by non-native animals, particularly goats that eat the plants and increase landslides in the natural cliff side habitat. Non-native, invasive plant taxa, such as <em>Ficus</em> sp., <em>Lantana camara</em>, <em>Melinis </em>sp., <em>Psidium cattleianum</em>, <em>Schinus terebinthifolius</em>, <em>Syzygium cumini</em>, continuously contribute to the displacement of native habitat for possible recruitment of <em>Brighamia insignis</em>. A severe lack of pollination occurring combined with predominately self-incompatibility, is also a major factor to the decline of this taxon. The loss of its pollinator(s) is suspected; this is believed to have been a hawkmoth based on the species floral biology (Walsh <em>et al</em>. 2019). In addition, Fortini <em>et al</em>. (2013) characterized this taxon as extremely vulnerable to climate change (vulnerability index 0.867). Hurricanes are a major threat; Hurricane Iniki in 1992 wiped out populations that remained on the southeastern part of Kauaʻi.</p>",<p></p><p><em>Brighamia insignis</em> was realized to be extinct in the wild in 2020 after numerous drone surveys confirmed the last known individual was no longer present.</p><p></p>,,"<p>This species was historically endemic to the Hawaiian islands of Kauaʻi and Niʻihau. On Kauaʻi, it was formerly found along the length of the island's north Nā Pali coast and in the southeast part of the island in the Haʻupu Mountain range. The last known wild individual occurred in Hoʻolulu Valley at 152 m elevation on the Nā Pali coast.</p>","<p>This taxon has been extremely popular for decades in the plant trade all over the world, both in botanic gardens and homes. In 1977 and 1978, then National Tropical Botanical Garden field botanist Steve Perlman collected seeds from the Waiahuakua population on the Nā Pali coast and distributed them to various botanical gardens around the world (Hannon and Perlman 2002). In the early 2000s in the Netherlands, Plant Planet cultivated and sold <em>Brighamia insignis</em> by the hundreds of thousands (Robin Schaap, Plant Planet Manager, pers. comm., February 2013). The following was reported in NTBG's Tropical Plant Database: Raw parts of the plants were eaten by early Hawaiians to treat consumption and other disorders (Degener, O. 1930. Ferns and Flowering Plants of Hawaii National Park). Crushed leaves mixed with sea salt are used to treat cuts and infections (R. Kanahele pers. comm. 2003).</p>",Terrestrial,"<em>Brighamia insignis </em>has been listed as Endangered on the U.S. Endangered Species List since 1994, and also on the State of Hawaiʻi Endangered Species List. With less than 50 individuals remaining in the wild for many years, it has also been a focus of the Hawaiʻi State Plant Extinction Prevention Program. Conservation collections, ex ­situ cultivation, propagule storage and applied research to inform best management practices has been ongoing at the National Tropical Botanical Garden (NTBG), as well as other institutions locally, nationally, and internationally. NTBG has outplanted hundreds <em>B. insignis</em> individuals at the Limahuli Garden and Preserve on the north shore of Kaua‘i. These plantings started in the living collection or lower garden portion in 1992 and in the Limahuli Lower Preserve in 2006 (Kava Vale, pers. comm., January 2015). Outplantings were also done at the Kīlauea Point National Wildlife Refuge on the northeast coast of Kaua‘i by the Department of Land and Natural Resources (DLNR) and volunteers in 1995 (Jennifer Waipa, pers. comm., January 2015). The Kīlauea Point outplanting, however, was not self-sustaining and all of those planted have since died (Kim Uyehara, pers. comm., April 2013). None of the outplantings have ever produced viable offspring without intense human intervention (without collection of seeds, which were likely the result of hand pollination, and propagation in a nursery). Results of an ex situ genetic diversity study have informed controlled crosses to increase heterosis, spearheaded by NTBG and Chicago Botanic Garden (CBG) (Walsh, 2015; Wood et al., 2020; Foster et al., 2022). Large outplantings have recently been done in NTBG's Limahuli and McBryde gardens to expand NTBG's ex situ living collection and they were set-up experimentally to investigate whether there is higher survivorship and fitness in progeny from more diverse crosses as informed by molecular work. Thousands of seeds are in storage in NTBG's Seed Bank and Laboratory.",Oceanian,2012,false,false,Global
185559739,113166006,Leucadendron spirale,Extinct,,2020,2019-09-02 00:00:00 UTC,3.1,English,"<em>Leucadendron spirale</em> formerly occurred in the Lower Breede River Valley in South Africa. Herbarium specimens of this species were collected in 1801 and 1819 and it was last recorded 1933. Extensive searches in the 1960s and 1990s, the latter accompanied by a reward of R1,000 (South African Rand), yielded no sign of the species. It was serotinous and unlikely to survive as seeds in soil-stored seedbanks. Cause of extinction is unknown, but is likely the result of habitat loss to crop cultivation, alien plant invasion and afforestation.","This species occurred in riverine and swampy areas. Mature individuals would have been killed by fires, and only seeds survive. Wind-dispersed seeds, stored in fire-resistant inflorescences, would have been released after fires. It was dioecious, with wind-pollinated male and female flowers occurring on separate plants.","This species has not been collected since 1933. Timber plantations and agriculture have caused severe loss of habitat at all the known locations. Plantations are no longer expanding within the known range of this species, but remaining habitat is often densely infested with alien invasive plants, especially near plantations, where escaping pine seedlings spread into adjacent fynbos.",There is no information about its former population size.,,"This species' former distribution was in the Breede River Valley between Wolseley and Botha, in the Western Cape Province of South Africa.",,Terrestrial,,Afrotropical,1933,false,false,Global
192624182,4135,Barbodes pachycheilus,Extinct,,2020,2019-12-31 00:00:00 UTC,3.1,English,"<p></p><em>Barbodes pachycheilus </em>was formerly known only from Lake Lanao, Philippines. This species was last recorded in 1964. This has not been recorded from the lake despite various market surveys and fish landing monitoring, as well as direct sampling conducted within the period 1973-2017. Local knowledge from fishermen, fish vendors, and housewives further confirmed the disappearance of this species over the years from Lake Lanao. Therefore, this species is assessed as Extinct. The main driver of extinction was the predatory invasive alien species, <em>Glossogobius giuris </em>(Gobiidae). Another predatory introduced species, <em>Giuris margaritaceus </em>(Eleotridae), translocated accidentally in the lake probably in the early 1970s or much earlier, may have also contributed to its extinction. This species is now the most dominant fish throughout Lake Lanao. Without the eradication of this invasive species, this can push the remaining endemic cyprinids in the lake to extinction. Other significant threats that impacted the survival of this endemic species include overexploitation, rampant use of destructive fishing methods, and unsustainable fishing practices.<em style=""background-image: initial; background-position: initial; background-size: initial; background-repeat: initial; background-attachment: initial; background-origin: initial; background-clip: initial; margin-top: 0pt; margin-bottom: 0pt;""><br/></em>",This lacustrine species most probably occupied the shallow shores of the lake (Herre 1926).,"The key driver of extinction was the introduction of predatory fish, mainly <em>Glossogobius giuris</em> (Gobiidae) which was accidentally translocated in Lake Lanao in the 1960s probably via stocking of aquaculture fish fry for fisheries enhancement in Lake Lanao (Sanguila<em>&#160;</em><span data-preserver-spaces=""true""><em>et al</em><span data-preserver-spaces=""true"">. 1975, Juliano&#160;<span data-preserver-spaces=""true""><em>et al</em><span data-preserver-spaces=""true"">. 1989, Guerrero 2001, P. Escudero pers. comm. 2016).&#160;<span data-preserver-spaces=""true""><span data-preserver-spaces=""true""><span data-preserver-spaces=""true""><span data-preserver-spaces=""true"">Another invasive alien species,&#160;<em>Giuris margaritaceus</em> (Eleotridae), was unintentionally introduced in the lake in the early 1970s or much earlier (Escudero 1995, P. Escudero pers. comm. 2016).&#160;This introduced eleotrid has become the most abundant species throughout the lake since 1982. Other threats that drive the endemic species towards extinction are overexploitation,&#160;rampant use of destructive fishing methods (i.e., dynamite fishing), unsustainable fishing practices (i.e., indiscriminate harvesting of gravid fish), extraction of water for industrial, agricultural and domestic uses, illegal logging and pollution (Metillo and Garcia-Hansel 2016, Ismail&#160;<em>et al</em>. 2014, Naga 2010, Guerrero 2001, Rosagaron 2001, Escudero 1995, Kornfield and Carpenter 1984, Escudero&#160;<em>et al</em>. 1980, Sanguila <em>et al</em>. 1975).&#160;<span data-preserver-spaces=""true""><span data-preserver-spaces=""true""><span data-preserver-spaces=""true""><span data-preserver-spaces=""true""><br/></span></span></span></span></span></span>","This species was last reported from Lake Lanao in 1964 (Villaluz 1966 in Sanguila <em>et al</em>. 1975). No extant population was recorded from direct sampling, market or fish landing surveys conducted in August- December 1973 (Sanguila <em>et al</em>. 1975), February-December&#160;1974, March-May 1975, June 1976-June 1977 (Escudero <em>et al</em>. 1980), August 1982-July 1983 (Escudero and Demoral 1983), possibly for a year in 1990-1991 (Escudero 1995), November 2000-January 2001 (Ali 2001, possibly also Bacarat 2001), September-October 2001&#160;(Hadji Ali 2002), July-October&#160;2008 (Ismail <em>et al</em>. 2014), and December 2015 (DENR 2015). Monitoring of fish landed catch was recently conducted from May 2016 to March 2017 in major landing sites of the northeastern, southeastern, northwestern, and southwestern parts of the lake but still failed to find this species (Torres 2018).&#160;The disappearance and absence of this species in Lake Lanao were further confirmed by local fishermen, fish vendors, and housewives through key informant interviews (Ismail <em>et al.&#160;</em>2014, Torres 2018).",,"<em>Barbodes pachycheilus </em>was formerly endemic to Lake Lanao, Mindanao, Philippines.&#160;Lake Lanao is the largest lake in Mindanao and the second largest lake in the Philippines. The lake is vital to the whole island of Mindanao. Together with its only outlet (Agus River), Lake Lanao is the major source of hydroelectric power, providing the majority of the electricity needs of Mindanao (Escudero 1995, Rosagaron 2001, Naga 2010, UPLB-DENR 2014). It has a surface area of 357 km<sup>2</sup>, a maximum depth of 112 m, a mean depth of 60.3 m, a replacement time of 6.5 years, and a lake surface altitude of 702 m (Frey 1969).",There is no existing fishery since this species is now extinct.,Freshwater (=Inland waters),<p></p><p>There are no past and ongoing conservation efforts for this species. Any conservation plan for this species is already too late .This species is evidently extinct in Lake Lanao.<br/></p>    <p><br/></p>,Indomalayan,1964,false,false,Global
192624320,12751,Barbodes resimus,Extinct,,2020,2020-01-01 00:00:00 UTC,3.1,English,"<em style=""color: rgb(14, 16, 26); background-image: initial; background-position: initial; background-size: initial; background-repeat: initial; background-attachment: initial; background-origin: initial; background-clip: initial; margin-top: 0pt; margin-bottom: 0pt;"">Barbodes resinus</em>&#160;is listed as Extinct because no individuals have been collected from Lake Lanao and its outlet, the Agus rapids for over 50 years. It was last reported in 1964. Various field sampling, market survey, and fish landing monitoring conducted within the period 1973-2017 failed to find a single individual of this species. The absence of this species in the lake for several decades was confirmed by local fishermen, fish vendors, and housewives through key informant interviews. Predation by introduced fish (mainly&#160;<em style=""color: rgb(14, 16, 26); background-image: initial; background-position: initial; background-size: initial; background-repeat: initial; background-attachment: initial; background-origin: initial; background-clip: initial; margin-top: 0pt; margin-bottom: 0pt;"">Glossogobius giuris</em>), overfishing, unsustainable fishing practices, and destructive fishing methods were key drivers of the extinction of this species. The ichthyofauna of Lake Lanao is now dominated by introduced species, with&#160;<em style=""color: rgb(14, 16, 26); background-image: initial; background-position: initial; background-size: initial; background-repeat: initial; background-attachment: initial; background-origin: initial; background-clip: initial; margin-top: 0pt; margin-bottom: 0pt;"">Giuris margaritaceus </em>(Eleotridae) as the most abundant species throughout the lake.  Given this widespread infestation of invasive alien species in Lake Lanao, the survival of this species and all other endemic fishes is unlikely. Research on how to eradicate this invasive species should be given a priority.<p></p>","This species occurred in Lake Lanao and Agus rapids, the only outlet of Lake Lanao (Herre 1924). Little is known about its biology.","This species is considered Extinct. Extinction of this species is attributed largely to predatory invasive alien fish,&#160;<em>Glossogobius giuris </em>(Gobiidae)<em>,</em>&#160;accidentally introduced in Lake Lanao in the early 1960s.probably via stocking of aquaculture fish fry for fisheries enhancement in Lake Lanao (Sanguila <em>et al.</em> 1975, Juliano&#160;<em>et al</em>. 1989, P. Escudero pers. comm. 2016).&#160;&#160;Other threats in Lake Lanao and its outlet that contributed to the disappearance of this endemic species include&#160;overexploitation, rampant use of destructive fishing methods (i.e., particularly dynamite fishing), unsustainable fishing practices (i.e.,&#160;indiscriminate harvesting of gravid fish),&#160;extraction of water for industrial, agricultural, and domestic uses, illegal logging, and pollution (Torres 2018, Metillo and Garcia-Hansel 2016, Ismail <em>et al</em>. 2014, Naga 2010, Guerrero 2001, Rosagaron 2001, Kornfield and Carpenter 1984, Escudero 1995, Escudero <em>et al</em>. 1980, Sanguila <em>et al.</em> 1975).&#160;&#160;Another invasive alien species,&#160;<em>Giuris margaritaceus</em> (Eleotridae), was unintentionally introduced in the lake probably in the early 1970s or much earlier (Escudero 1995, P. Escudero pers. comm. 2016).&#160;This introduced eleotrid has become the most abundant species throughout the lake since 1982 and may have impacted the survival of this species.","This species was last recorded in 1964 (Villaluz 1966 in Sanguila&#160;<em>et al</em>. 1975). No extant population of this species has been found after several surveys conducted in August- December 1973 (Sanguila&#160;<em>et al.</em>&#160;1975), February-December 1974, March-May 1975, June 1976-June 1977 (Escudero&#160;<em>et al</em>. 1980), August 1982-July 1983 (Escudero and Demoral 1983), most probably for a year in 1990-1991 (Escudero 1995), November 2000-January 2001 (Ali 2001, possibly also Bacarat 2001), September-October 2001 (Hadji Ali 2002), July-October 2008 (Ismail&#160;<em>et al</em>. 2014), and December 2015 (DENR 2015). Fish landed catch monitoring from May 2016-March 2017&#160;in&#160;major landing sites of the northeastern, southeastern, northwestern, and southwestern parts of the lake also did not find this species (Torres 2018).&#160;The disappearance of this species from the lake was further confirmed by local fishermen, fish vendors, and housewives through key informant interviews (Ismail&#160;<em>et al</em>. 2014, Torres 2018).",,"<em>Barbodes resinus </em>formerly occurred in Lake Lanao and its outlet (Agus rapids), Mindanao, Philippines. Lake Lanao is the largest lake in Mindanao and the second largest lake in the Philippines. The lake is vital to the whole island of Mindanao. Together with its only outlet (Agus River), Lake Lanao is the major source of hydroelectric power, providing the majority of the electricity needs of Mindanao (Escudero 1995, Rosagaron 2001, Naga 2010, UPLB-DENR 2014). It has a surface area of 357 km<sup>2</sup>, a maximum depth of 112 m, a mean depth of 60.3 m, a replacement time of 6.5 years, and a lake surface altitude of 702 m (Frey 1969).",There is no existing utilization and trading because this species is now extinct.,Freshwater (=Inland waters),Conservation actions are not applicable since the species is now extinct.<br/><br/>  <p><br/></p>,Indomalayan,1964,false,false,Global
192624463,15633,Barbodes palaemophagus,Extinct,,2020,2020-01-01 00:00:00 UTC,3.1,English,"<em>Barbodes palaemophagus</em> formerly occurred only in Lake Lanao, Philippines. This species is assessed as Extinct. Its presence in Lake Lanao was last recorded in 1975. Past and recent field sampling, market surveys, and fish landing monitoring conducted within the period 1976-2018&#160;did not detect any individuals of this species. This indicates that the species has not been recorded from the lake for over 40 years. Recent key informant interviews with local fishermen, fish vendors, and housewives confirmed the disappearance or absence for decades of this species in Lake Lanao. The extinction of this species was mainly due to the introduction of predatory fish (<em>Glossogobius giuris</em>, a gobiid accidentally translocated in Lake Lanao in the early 1960s), overfishing, rampant use of destructive fishing methods, and unsustainable fishing practices.&#160;<em>Giuris margaritaceus</em> (Eleotridae), another unintentionally introduced fish in the lake in the 1970s, may have also contributed to its extinction. This species is now the most dominant fish throughout Lake Lanao. Without the eradication of this&#160;invasive species, this will push the remaining&#160;endemic cyprinids in the lake to extinction.&#160;<br/><br/><p></p>",This lacustrine species most probably inhabited the shallow shores of the lake (Herre 1926).,"Various threats in Lake Lanao led to the disappearance of this species. These include the introduction of predatory fishes (<em>Glossogobius giuris</em> (Gobiidae), unintentionally introduced in the 1960s; eleotrid <em>Giuris margaritaceus</em> (Eleotridae), accidentally translocated in the early 1970s or much earlier), overexploitation, rampant use of destructive fishing methods (i.e., dynamite fishing), unsustainable fishing practices (i.e., indiscriminate harvesting of gravid fish), extraction of water for industrial, agricultural and domestic uses, illegal logging, and pollution (Torres 2018, Metillo and Garcia-Hansel 2016, Ismail <em>et al</em>. 2014, Naga 2010, Guerrero 2001, Rosagaron 2001, Juliano<em> et a</em>l. 989, Kornfield and Carpenter 1984, Escudero <em>et al</em>. 1980, Escudero 1995, Sanguila <em>et al</em>. 1975). It is believed that this species was mainly threatened by the predation of invasive alien species  (<em>G. giuris</em>), overexploitation, rampant use of destructive fishing methods, and unsustainable fishing practices (Sanguila <em>et al</em>. 1975, Escudero 1995).","<p>There is no extant population that remains in Lake Lanao or elsewhere. This species was last recorded in 1975 (Escudero&#160;<em style=""background-image: initial; background-position: initial; background-size: initial; background-repeat: initial; background-attachment: initial; background-origin: initial; background-clip: initial; color: rgb(14, 16, 26); margin-top: 0pt; margin-bottom: 0pt;"">et al</em>. 1980). This species has not been recorded during market surveys and fish landing monitoring, as well as direct field sampling conducted in June 1976-June 1977 (Escudero<em style=""background-image: initial; background-position: initial; background-size: initial; background-repeat: initial; background-attachment: initial; background-origin: initial; background-clip: initial; color: rgb(14, 16, 26); margin-top: 0pt; margin-bottom: 0pt;"">&#160;et al</em>. 1980), August 1982-July 1983 (Escudero and Demoral 1983), most probably for a year in 1990-1991 (Escudero 1995), November 2000-January 2001 (Ali 2001, possibly also Bacarat 2001), September-October 2001 (Hadji Ali 2002), July-October 2008 (Ismail&#160;<em style=""background-image: initial; background-position: initial; background-size: initial; background-repeat: initial; background-attachment: initial; background-origin: initial; background-clip: initial; color: rgb(14, 16, 26); margin-top: 0pt; margin-bottom: 0pt;"">et al</em>. 2014), and December 2015 (DENR 2015). Monitoring of fish landed catch was conducted from May 2016 to March 2017 in major landing sites of the northeastern, southeastern, northwestern, and southwestern parts of the lake but still no single individual of this species was found (Torres 2018). Local fishermen, fish vendors, and housewives have not encountered this species in the lake and fish markets&#160;for decades already&#160;based on key informant interviews (Ismail&#160;<em style=""background-image: initial; background-position: initial; background-size: initial; background-repeat: initial; background-attachment: initial; background-origin: initial; background-clip: initial; color: rgb(14, 16, 26); margin-top: 0pt; margin-bottom: 0pt;"">et al</em>. 2014, Torres 2018).</p>",,"This species was formerly endemic to Lake Lanao, Mindanao, Philippines.&#160;Lake Lanao is the largest lake in Mindanao and the second largest lake in the Philippines. The lake is vital to the whole island of Mindanao. Together with its only outlet (Agus River), Lake Lanao is the major source of hydroelectric power, providing the majority of the electricity needs of Mindanao (Escudero 1995, Rosagaron 2001, Naga 2010, UPLB-DENR 2014). It has a surface area of 357 km<sup>2</sup>, a maximum depth of 112 m, a mean depth of 60.3 m, a replacement time of 6.5 years, and a lake surface altitude of 702 m (Frey 1969).",<p>No utilization and trading exist because this species is now extinct. <br/><strong></strong></p>,Freshwater (=Inland waters),Conservation of this species comes too late.,Indomalayan,1975,false,false,Global
