assessmentId,internalTaxonId,scientificName,redlistCategory,redlistCriteria,yearPublished,assessmentDate,criteriaVersion,language,rationale,habitat,threats,population,populationTrend,range,useTrade,systems,conservationActions,realm,yearLastSeen,possiblyExtinct,possiblyExtinctInTheWild,scopes
236684638,146907699,Achyranthes mangarevica,Extinct,,2023,2015-12-17 00:00:00 UTC,3.1,French,"<em>Achyranthes mangarevica</em> était une espèce endémique de l’île de Mangareva, dans l'archipel des Gambier, considérée aujourd'hui comme éteinte. Elle n'a été observée qu'une seule fois, dans une seule station, dans les années 1930. Malgré plusieurs prospections, l'espèce n'a pas été revue. Les raisons de son extinction seraient les incendies, les chèvres et les plantes exotiques envahissantes.","Falaises continentales, pavements et affleurements rocheux.","Pâturage exercé par les herbivores introduits (chèvres), incendies, plantes exotiques envahissantes.",Cette espèce est évaluée comme Éteint.,,Cette espèce est endémique de Polynésie française.,Il n'existe pas d'information sur l'usage ou le commerce de cette espèce.,Terrestrial,Espèce protégée dans le 'Code de l'environnement de Polynésie française'.,Oceanian,1934,false,false,Global
236694411,236694409,Ceodes rapaensis,Extinct,,2023,2015-12-17 00:00:00 UTC,3.1,French,"Autrefois présente dans les forêts de basse altitude, <em>Ceodes rapaensis </em>était une espèce endémique de l’île de Rapa, dans l'archipel des Australes, considérée aujourd'hui comme éteinte. Elle n'a été observée qu'une seule fois, en 1921. Malgré plusieurs prospections et la facilité d'accès à son habitat, l'espèce n'a pas été revue. Les raisons de son extinction seraient la présence de boeufs et de chèvres, les plantes exotiques envahissantes et les incendies.",Forêt tropicale humide de basse altitude.,"Pâturage exercé par les herbivores introduits (chèvres, bœufs), plantes exotiques envahissantes, incendies.",Cette espèce est évaluée comme Éteint.,,Cette espèce est endémique de Polynésie française.,Il n'existe pas d'information sur l'usage ou le commerce de cette espèce.,Terrestrial,Espèce protégée dans le 'Code de l'environnement de Polynésie française'.,Oceanian,1921,false,false,Global
238086085,62307504,Eclectus infectus,Extinct,,2023,2023-06-16 00:00:00 UTC,3.1,English,"This species may have survived as recently as the late 18th century, but became Extinct most likely as a result of over-hunting and predation by invasive mammals.",Nothing directly relating to the habits of this lost species is known.,This species was presumably driven to extinction by overhunting and predation from introduced mammals (Hume 2017).,None remain.,,"<em>Eclectus infectus</em> was described by D. W. Steadman (2006a) from bones found at archaeological  (late Holocene) and paleontological (late Pleistocene) sites on three  islands in <strong>Tonga</strong>, and presumably relates to a drawing of a parrot from  the Malaspina expedition to Vava’u, Tonga in 1793 (Steadman 2006b, Olson  2006), soon after which time it presumably became extinct. It may possibly have also occurred on Vanuatu and Fiji (Hume and Walters 2012).",Over-hunting presumably played a role in this species' extinction (Hume 2017).,Terrestrial,,Oceanian,1793,false,false,Global
238086539,22728673,Cyanoramphus ulietanus,Extinct,,2023,2023-06-16 00:00:00 UTC,3.1,English,"This species was known from the island of Raiatea, French Polynesia, but it is now Extinct, probably as a result of habitat clearance or the action of invasive species. Two specimens were collected in the early 1770s and its extinction likely followed.","It was presumably a forest species, as this was the native vegetation of all of the Society Islands<strong> </strong>(Forshaw and Cooper 1989).  <p></p>","The reasons for its extinction are unknown, but may have been the result of the clearance of the islands' forests, hunting, or predation by introduced species<strong> </strong>(Forshaw and Cooper 1989). <p></p>",No extant population remains.,,"<em>Cyanoramphus ulietanus </em>is only known from two specimens from Raiatea, <strong>French Polynesia</strong> (Forshaw and Cooper 1989), likely collected on James Cook's voyage in 1773 or 1774, and now in Vienna (Austria) and Tring<strong> </strong>(U.K.) (Knox and Walters 1994, Hume 2017).  <p></p>",Over-hunting likely contributed to this species' disappearance (Hume 2017).,Terrestrial,,Oceanian,1774,false,false,Global
238867701,22685182,Cyanoramphus zealandicus,Extinct,,2023,2023-06-29 00:00:00 UTC,3.1,English,"This species was known from Tahiti, French Polynesia, but it has not been recorded since 1844 and is now Extinct. Possible causes include deforestation, hunting and predation by introduced species.","Like Raiatea Parakeet <em>C. uleitanus</em>, the species was presumably a forest bird<strong> </strong>(Forshaw and Cooper 1989).  <p></p>","Its demise could have resulted from habitat loss, hunting or predation by introduced species<strong> </strong>(Forshaw and Cooper 1989, Hume 2017). <p></p>",None remain.,,"<em>Cyanoramphus zealandicus </em>is known from Tahiti, <strong>French Polynesia,</strong> from three specimens (two of which are now in Liverpool and one in Tring, U. K.) collected on James Cook's voyage in 1773, a fourth collected by G. Amadis in 1842, now in Perpignan<strong><sup> </sup></strong>(France) and a fifth collected by M. J. de Marolles in 1844, now in Paris<strong> </strong>(France) (Voisin <em>et al. </em>1995).  <p></p>",Over-hunting likely contributed to this species' disappearance (Hume 2017).,Terrestrial,,Oceanian,1844,false,false,Global
238869019,22685156,Psephotellus pulcherrimus,Extinct,,2023,2023-06-29 00:00:00 UTC,3.1,English,"This species was formerly found in eastern Australia, but it is now Extinct owing mainly to drought and overgrazing. It has not been recorded since 1927.","It was a specialist of open savanna woodland and shrubby grassland, feeding on native grass seeds and nesting in termite mounds (Olsen 2007).  <p></p>","Its extinction was probably sealed by a reduction of its food supply due to drought and overgrazing (Olsen 2007). Altered fire frequencies and the spread of prickly pears<strong> </strong>(Joseph 1988), disease, trapping and egg-collecting<strong> </strong>(Garnett 1992), predation of nests by introduced and native species<strong> </strong>(Chisholm 1922) and clearance of eucalypts by ringbarking<strong> </strong>(Kiernan 1993) also contributed. Following major reduction in the species' population size, it appears that inbreeding inhibited its fertility (Jerrard 2008).<br/><p></p>",None remain.,,"<em>Psephotellus pulcherrimus </em> was found in eastern <strong>Australia</strong>, only reported with certainty from southeastern Queensland. Claims from the north of the state are likely to have been mistaken. The species is also often said to have been found in New South Wales, but there have been no confirmed records (Olsen 2007). It was locally common although generally scarce in the 19th century<strong> </strong>(Forshaw and Cooper 1989), but then declined rapidly and was thought to have become extinct as a result of the drought of 1902 until it was rediscovered in 1918<strong> </strong>(Chisholm 1922). The last confirmed observation was in 1927 (Hume 2017). Some credible reports continued into the 1930s and '40s (Olsen 2007), but although Kiernan (1993) claims to have seen five birds in 1990<strong></strong>, the species is now considered Extinct<strong> </strong>(Collar <em>et al</em>. 1994).   <p></p>",Trapping for the pet trade likely contributed to this species' decline (Hume 2017).,Terrestrial,<p></p><strong></strong>,Australasian,1927,false,false,Global
238884608,22710511,Aplonis fusca,Extinct,,2023,2023-06-29 00:00:00 UTC,3.1,English,"This species was formerly found on the Australian islands of Norfolk and Lord Howe, but it is now Extinct owing to Black Rat predation, habitat destruction and competition with introduced birds. The last record was of the nominate subspecies on Norfolk Island in 1923; it was certainly gone by the time the island was visited in 1968.","Though it is likely to have inhabited forest and scrub it also fed on fruit and crops, and was even regarded as something of a pest. It nested in tree hollows (Garnett <span style=""font-style: italic;"">et al.</span> 2011). <p></p>","The extinction of the Lord Howe Island population was due to the arrival of Black Rat <em>Rattus rattus</em> on the island in 1918 (Hume 2017). The reasons for the extinction of the Norfolk Island population are less clear, however&#160;may have become extinct as a result of habitat destruction and competition with introduced birds<strong>&#160;</strong>(Garnett 1992, Hume 2017). This population was also persecuted as it fed on fruit and crops (Hume 2017).<p></p>",No extant population remains.,,"<em>Aplonis fusca </em>was endemic to <strong>Norfolk Island (to Australia) </strong>and Lord Howe Island,<strong> Australia</strong> (Garnett 1992).<strong> </strong>On Lord Howe Island, the population of subspecies <em>hulliana</em><strong><sup> </sup></strong>tumbled to extinction from numbering thousands in 1913-1915 - it was not seen after 1918<strong> </strong>and was certainly extinct by 1928 (Sharland 1929, Hindwood 1940, Garnett 1992). The nominate subspecies on Norfolk Island was last recorded in 1923<strong> </strong>(Garnett 1992), although its absence was not noted until 1968 (Smithers and Disney 1969). <p></p>",,Terrestrial,,Oceanian,1923,false,false,Global
238886213,22710496,Aplonis corvina,Extinct,,2023,2023-06-29 00:00:00 UTC,3.1,English,"This species was known from the island of Kosrae, Micronesia, but it is now Extinct likely due to forest disturbance and predation by introduced rats. The last specimens were taken in 1827, and it was absent when the island was next visited in 1880.",It inhabited mountain forests.  <p></p>,"Its extinction may have been partly attributable to depredation by introduced rats, which were accidentally introduced by whalers and are abundant on the island. However, forest disturbance likely also played a role (Hume 2017).<p></p>",None remain.,,"<em>Aplonis corvina </em>was endemic to Kosrae, Caroline Islands, <strong>Federated States of Micronesia</strong> (Greenway 1967). It is only known from two specimens, both collected by Heinrich von Kittlitz in 1827<strong>&#160;</strong>(Knox and Walters 1994), and both now in St Petersburg<strong> </strong>(Pratt <em>et al</em>. 1987). It was extinct by the time that Otto Finsch visited the island in 1880<strong> </strong>(Greenway 1967). <p></p>",,Terrestrial,,Oceanian,1827,false,false,Global
241413513,34169,Dendroseris gigantea,Extinct in the Wild,,2023,2023-08-02 00:00:00 UTC,3.1,English,"This species is native to Alejandro Selkirk Island in the Juan Fernandez Archipelago, Chile. <em>Dendroseris gigantea</em>&#160;was assessed as Critically Endangered in 1998, however, its natural population declined to extinction in 2014. Park rangers at Juan Fernández National Park collected seeds of the species to save it from extinction, currently it only survives in cultivation. It is assessed as Extinct in the Wild.","A low&#160;palm-like pachycaul tree or shrub, 5–10 m high.&#160;It originally inhabited the understory of the myrtle forest of Alejandro Selkirk Island on edges and walls of ravines, between near sea level to 500 m asl (Johow 1896, Skottsberg 1921, Rodríguez <em>et al.</em> 2018).","<p>The population was reduced mainly due to herbivory by goats, rabbits and rats (Penneckamp 2018, Sáez <em>et al.</em>&#160;unpublished data).</p>","<p>Its natural population was reduced to extinction, mainly due to caprine herbivory. The last known wild specimen died in March 2014, and from which park rangers collected seeds and managed to cultivate it, saving it from extinction (Penneckamp 2018). It is now extinct in the wild.</p>",,"This species is endemic to Alejandro Selkirk Island of the Juan Fernández Archipelago, Chile (Johow 1896, Penneckamp 2018, Rodríguez <em>et al</em>. 2018). According to historical records, the species grew in Quebrada Las Casas (Johow 1896), between Quebrada de Sánchez and Quebrada del Varadero and in Quebrada los Inocentes at medium altitude (Skottsberg 1921). More recent records by Ricci (2006), indicated the existence of two individuals growing on the edge of Barranco de Varadero, however, in 2014 the last wild individual is reported to have died (Penneckamp 2018). The species currently survives in cultivation on Robinson Crusoe Island.",,Terrestrial,"Its natural population developed in the Juan Fernández Archipelago National Park and Biosphere Reserve. Several attempts have been made to reintroduce the species from cultivated individuals, however, these have been unsuccessful in the face of predation by rats. There are currently four individuals in the gardens of Robinson Crusoe (Sáez <em>et al. </em>unpublished data).",Neotropical,March 2014,false,false,Global
241563797,103780078,Acrocephalus luscinius,Extinct,,2023,2023-08-04 00:00:00 UTC,3.1,English,"This species qualifies as Extinct. It is likely that the introduced Brown Tree Snake&#160;<em>Boiga irregularis</em>&#160;delivered the final blow to the species following significant habitat loss from wetland drainage and increased frequency in fires, potential impacts from pesticides and impacts of a variety of additional introduced species (Reichel&#160;<em>et al.</em> 1992, Kennerley and Pearson 2010).<p></p> <p></p>","<em>Acrocephalus luscinius</em>&#160;was almost exclusively found in freshwater wetland and wetland edge vegetation (Engbring <em>et al</em>. 1982,<strong></strong> Reichel <em>et al.</em> 1992, USFWS 1998)<strong></strong>. <p></p>","The species was exterminated as a result of predation by the introduced Brown Tree Snake (<em>Boiga irregularis</em>). Several other factors are likely to have also contributed, including wetland destruction and drainage, pesticide-use, major fires and additional introduced species (Hume 2017).<br/><p></p>","The last confirmed sighting of this species was made in 1969, having been said to still be ‘fairly common’ in parts of the Agana Swamp in 1967 or 1968 before rapidly disappearing from this, the species’ last site (Reichel&#160;<em>et al.</em>&#160;1992). As with&#160;<em>A. yamashinae</em>&#160;the species was primarily restricted to wetland habitats, which suffered considerable disturbance (Reichel&#160;<em>et al.</em>&#160;1992). It is likely that the introduced Brown Tree Snake&#160;<em>Boiga irregularis</em>&#160;delivered the final blow to the species following significant habitat loss from drainage and fires, potential impacts from pesticides and impacts of a variety of additional introduced species (Reichel&#160;<em>et al.&#160;</em>1992, Kennerley and Pearson 2010).",,This species is historically known from <strong>Guam (to USA).</strong><p></p>,,Terrestrial|Freshwater (=Inland waters),<p></p>,Oceanian,1969,false,false,Global
241570030,103780109,Acrocephalus nijoi,Extinct,,2023,2023-08-04 00:00:00 UTC,3.1,English,"There have been no records of the species since the mid-1990s despite extensive surveys in 2000, 2001, 2008 and 2009, its disappearance likely primarily due to large-scale vegetation clearance. It is therefore classified as Extinct.","It inhabited formerly disturbed areas vegetated by groves of trees and thickets (Engbring <em>et al</em>. 1982,<strong></strong> Reichel <em>et al.</em> 1992, USFWS 1998)<strong></strong>. <p></p>",Habitat destruction as a result of intensive farming is likely responsible for this species' disappearance (Reichel <em>et al.</em> 1992). Goats (<em>Capra hircus</em>) introduced in the 1950s may have also been a contributing factor (Hume 2017).<p></p>,"A tiny population was reported to remain on the uninhabited island, but has not been observed since the mid-1990s despite extensive surveys in 2000, 2001, 2008, and 2009 (USFWS 1998, Esselstyn&#160;<span style=""font-style: italic;"">et al.&#160;</span>2003, Camp&#160;<span style=""font-style: italic;"">et al.&#160;</span>2009, Amidon&#160;<em>et al.</em>&#160;2014), and the species is now considered to be Extinct.",,This species is historically known only from Aguijan in the <strong>Northern Mariana Islands (to USA).&#160;</strong><p></p>,,Terrestrial,<p></p>,Oceanian,1995,false,false,Global
241594199,103780103,Acrocephalus yamashinae,Extinct,,2023,2023-08-04 00:00:00 UTC,3.1,English,"The species is considered to have become extinct prior to the 1981 volcanic eruption on Pagan, though this event destroyed hopes of the species persisting to the present day. Surveys in the 1970s, 1980s, in 2000 and in 2010 all failed to find any trace of the species, its disappearance primarily a result of severe habitat modification.&#160;<p></p> <p></p>","It was almost exclusively found in freshwater wetland and wetland edge vegetation (Engbring <em>et al</em>. 1982,<strong></strong> Reichel <em>et al.</em> 1992, USFWS 1998)<strong></strong>. <p></p>","On Pagan virtually all vegetative ground cover was effectively removed at certain periods during the 20th century through a variety of agents including human development, introduced feral ungulates and finally a volcanic eruption in 1981 (Reichel&#160;<em>et al.&#160;</em>1992, Hume 2017). However, there had not been any records for some time prior to this, with reports of reed-warblers being present by D. Aldan and J. Sablan into at least the 1960s (Reichel&#160;<em>et al.</em>&#160;1992) appearing to be the last observations. The primary threat is thought to have been severe habitat modification through wetland drainage for agriculture and grazing by feral livestock (Hume 2017). Predation by rats and cats is also thought to have driven declines (Hume 2017). The volcanic eruptions in 1981 appear to mark a full stop to the possibility of the species persisting, as all herbaceous and virtually all woody vegetation was destroyed in the last known site, around the upper lake (Reichel&#160;<em>et al.&#160;</em>1992).<p></p>",None remain.,,This species is historically known from Pagan in the <strong>Northern Mariana Islands (to USA).</strong><p></p>,,Terrestrial|Freshwater (=Inland waters),<p></p>,Oceanian,1969,false,false,Global
243935542,103780156,Acrocephalus astrolabii,Extinct,,2024,2023-08-29 00:00:00 UTC,3.1,English,"This species has not been recorded since the type series collection in 1838 or 1839, likely driven to extinction by deforestation and introduced predators.<p></p> <p></p>",Essentially nothing is known about this species' ecology. It presumably occupied habitat similar to closely related <em>Acrocephalus </em>species such as <em>A. percernis</em>.<p></p>,This species was likely driven to extinction by deforestation and the introduction of predators (Hume 2017).<p></p>,None remain.,,"This species is known from two specimens thought to have come&#160;from the Gambier Islands, <strong>French Polynesia </strong>(Cibois <em>et al. </em>2011, Hume 2017).<p></p>",,Terrestrial|Freshwater (=Inland waters),<p></p>,Oceanian,1839,false,false,Global
243950218,22735592,Acrocephalus musae,Extinct,,2024,2023-08-29 00:00:00 UTC,3.1,English,"This species was lost from both islands where it used to occur in the late 1800s or early 1900s and is now Extinct, likely as a result of introduced predators.&#160;<p></p>",Little known. It may have bred exclusively in bamboo thickets (P. Raust <em>in litt. </em>2007)<strong></strong>.  <p></p>,"The introduction of&#160;feral cats <em>Felis catus</em>, rats <em>Rattus </em>spp.&#160;(A. Gouni<em> in litt. </em>2012) and&#160;many alien bird species, including the aggressive Common Myna <em>Acridotheres tristis</em>, may have contributed to its extinction (Thibault 1988, Seitre and Seitre 1991).<strong></strong>  <p></p>",None remain.,,"<em>Acrocephalus&#160;</em><span style=""font-style: italic;"">musae</span>&#160;was known from the Society Islands,&#160;<strong>French Polynesia</strong>.  <p></p>",,Terrestrial,<strong><br/></strong><p></p>,Oceanian,1880,false,false,Global
243955451,103829706,Himatione fraithii,Extinct,,2024,2023-08-29 00:00:00 UTC,3.1,English,"This Laysan endemic honeycreeper became Extinct in 1923 due to the almost complete destruction of vegetation cover on the island following the introduction of rabbits as a food supply for guano miners in the 1890s. The final act was a violent storm, in which what were considered the final three individuals were killed.","Rothschild (1893-1900, in Fancy and Ralph 1997) stated that the species was ""by far the rarest of the Laysan Island birds, though I have observed a fair number, generally in pairs. They are very active in their movements, flitting about in the scrub. It feeds on very small insects as a rule, but I have also observed it sucking honey from the flowers.""","The introduction of rabbits as a food supply for the guano miners that worked the Laysan Islands at the turn of the 20th Century was disastrous for the species. Virtually all vegetative cover on the island was eliminated, and the final three individuals were apparently killed in a vicious storm in 1923, with no shelter remaining on the island (Olson 1996, Fancy and Ralph 1997, Hume 2017).",None remain.,,"<span style=""font-style: italic;"">Himatione fraithii</span>&#160;was endemic to Laysan, in the northwestern Hawaiian Islands, <strong>United States</strong>, but became extinct in 1923 (Hume 2017).",,Terrestrial,,Oceanian,1923,false,false,Global
243957534,22720840,Ciridops anna,Extinct,,2024,2024-07-11 00:00:00 UTC,3.1,English,"This species is known from Hawaii's Big Island, USA, but it is now Extinct due to the destruction and degradation of its forest habitat as a result of logging activity, rats and pigs. The last confirmed records date from 1892.","Apparently inhabited&#160;<em>Pritchardia</em>&#160;groves, throughout montane rain forests dominated by ‘öhi‘a-lehua (Pratt 2020).<p></p>",Deforestation and seed predation by rats and pigs is thought to have severely reduced available habitat (Hume 2017).<p></p>,None remain.,,"<em>Ciridops anna </em>was endemic to Hawaii, <strong>USA</strong>. It is only known from five specimens, in Harvard, Honolulu, New York and Tring<strong> </strong>(Greenway 1967), the latter with two<strong> </strong>(Knox and Walters 1994), and a possible sight record in 1937<strong> </strong>(Munro 1944). Fossils of the genus have been found on Kaua'i, Moloka'i and O'ahu<strong> </strong>(James and Olson 1991). The last specimen was collected in 1892<strong></strong><span style=""font-weight: bold;""> </span>(Greenway 1967).  <p></p>",,Terrestrial,,Oceanian,1937,false,false,Global
243963448,22720848,Drepanis pacifica,Extinct,,2024,2023-08-29 00:00:00 UTC,3.1,English,"This species is known from the Hawaiian Islands, USA, but it has not been recorded since 1898 and is now Extinct. Habitat destruction was probably the major cause of its extinction.","It inhabited forest, especially `ohi`a forest<strong></strong> (Stattersfield <em>et al</em>. 1998), where it was observed feeding on insects, although it probably fed mainly on nectar.  <p></p>","It was heavily trapped by Hawaiians for its feathers<strong> </strong>(Rose <em>et al</em>. 1993), but it is more likely that habitat destruction and disease were the ultimate causes of the species' extinction<strong> </strong>(Greenway 1967, Hume 2017). <p></p>",None remain.,,"<em>Drepanis pacifica </em>was endemic to the big island of Hawai`i, <strong>USA&#160;</strong>(Hume 2017).<p></p>",,Terrestrial,,Oceanian,1898,false,false,Global
244230219,22720852,Drepanis funerea,Extinct,,2024,2023-09-04 00:00:00 UTC,3.1,English,"This species is known from the Hawaiian island of Moloka`i, USA, but it has not been recorded since 1907 and is now Extinct. Predation and habitat destruction by invasive species were the major factors causing its extinction.",It inhabited the understory of wet forests where it fed on nectar.  <p></p>,"Its extinction was probably largely caused by the destruction of its understorey habitat by introduced cattle and deer, mosquito-borne&#160;diseases and predation by rats and mongooses&#160;(Greenway 1967, Hume 2017). <p></p>",None remain.,,"<em>Drepanis funerea </em>was only ever seen in forest understorey on Moloka`i, Hawai`i, <strong>USA</strong>, although fossils are known from the adjacent Maui<strong> </strong>(James and Olson 1991).<p></p>",,Terrestrial,,Oceanian,1907,false,false,Global
244234437,22720749,Rhodacanthis palmeri,Extinct,,2024,2023-09-04 00:00:00 UTC,3.1,English,"This species was known from Hawaii's Big Island, USA, but it is now Extinct likely due to habitat loss and the effects of introduced species. It was last recorded in 1896, and collectors visiting in 1906 failed to find it.","This species was restricted to Koa <em>Acacia koa </em>forests between 1,220 m and 1,520 m (Hume 2017).<p></p>","Deforestation, as well as degradation, competition, predation and disturbance from introduced alien species likely contributed to this species' extinction (Hume 2017). Mosquito-borne diseases were also likely a significant threat (Hume 2017).<p></p>",None remain.,,"<em>Rhodacanthis palmeri</em> was endemic to Hawai'i, <strong>USA</strong> (Stattersfield <em>et al</em>. 1998).<p></p>",,Terrestrial,,Oceanian,1896,false,false,Global
