assessmentId,internalTaxonId,scientificName,redlistCategory,redlistCriteria,yearPublished,assessmentDate,criteriaVersion,language,rationale,habitat,threats,population,populationTrend,range,useTrade,systems,conservationActions,realm,yearLastSeen,possiblyExtinct,possiblyExtinctInTheWild,scopes
178409463,22690740,Zenaida graysoni,Extinct in the Wild,,2020,2020-08-26 00:00:00 UTC,3.1,English,"The last record of an individual of this species in its natural habitat was in 1972. It is therefore classified as Extinct in the Wild. However, there are c.150 birds in captivity and reintroduction of the species is planned.","It was apparently commonest in forested areas above 500 m, dominated by Bumelia, Prunus serotina, Guettarda, Ilex, Psidium and Ficus. It was a highly terrestrial frugivore, and probably depended on an intact understorey of ferns and euphorbias.","The decline and extinction in the wild of this species has been attributed chiefly to predation by cats. However, it was thought that cats became feral on Socorro in the 1950s, but this date has now been revised to the early 1970s (J. E. Martínez-Gómez in litt. 1999, 2000). This suggests that other factors, such as human predation (Martínez-Gómez et al. 2003) and high levels of understorey grazing by sheep, may have been significant. Outbreaks of a permanent locust Schistocerca piceifrons swarm have occurred twice a year since 1994, resulting in damage to the leaves, flowers and fruit of indigenous forests, with at least 30 ha lost to defoliation so far, thus reducing the extent of prime habitat for the species (J. E. Martínez-Gómez in litt. 2007). Locust outbreaks may be favoured by the habitat degradation caused by introduced species (Song et al. 2006).","Fortunately, aviculture has prevented the extinction of the species, with captive populations held in around 30 institutions in the U.S.A., Europe and Mexico, with at least 70 institutions participating at some point in the captive breeding efforts since 1994 (J. E. Martínez-Gómez in litt. 2016). The European breeding programme for this endangered species has monitored the captive population for more than 30 years (J. E. Martínez-Gómez in litt. 2007). The captive population was thought to total several hundred birds, but hybridisation with Mourning Doves Z. macroura became a major problem in the U.S.A. in the 1990s (Martínez-Gómez et al. 2003), and it now appears that many of these U.S. birds are hybrids (J. E. Martínez-Gómez in litt. 1999, 2000, S. G. Stadler in litt. 2012). As a consequence of the occurrence of avian influenza in Europe in 2006, the Socorro Dove Project sent a total of 12 birds to Albuquerque Biological Park to form a second, independent reserve population nearer to the species's native country (S. G. Stadler in litt. 2012). The total captive population is currently estimated at approximately 150 individuals (J. E. Martínez-Gómez in litt. 2016). In 2013 and again in 2014 a number of birds were transferred to Mexico to form a national captive breeding flock ahead of efforts to eventually return the species to Socorro Island (H. Horblit in litt. 2013, J. E. Martínez-Gómez in litt. 2016).","","This species has been extirpated from Socorro in the Revillagigedo Islands, Mexico. It was formerly common and observations in 1957 and 1958 gave no indication that it was declining. The last sighting in the wild was in 1972 (Baptista and Martínez-Gómez 1996), and all suitable habitat on the island has been surveyed subsequently without recording the dove (J. E. Martínez-Gómez in litt. 1999, 2000). Several individuals were taken during an expedition to the islands in 1925 and subsequently bred in the U.S.A., with some sent to Europe (Martínez-Gómez et al. 2003).","",Terrestrial,"Conservation Actions UnderwayThe Revillagigedo Islands were declared a biosphere reserve in 1994 (Stattersfield et al. 1998, Martínez-Gómez et al. 2003). The European Association of Zoos and Aquaria recognised a breeding programme for the species, as initiated by Cologne and Frankfurt zoos (Germany) and the private interest group Wild Pigeons and Doves, as an official European Endangered species programme (EEP), in 1995 (Martínez-Gómez et al. 2003). Modern studbook software has been employed to assist with the genetic and demographic management of the captive population. Individuals have been distributed to zoos and bird parks in countries including Belgium, the Netherlands, U.K., Poland, Austria, Luxembourg, France, Spain, the Czech Republic and Germany (S. G. Stadler in litt. 2007, 2012). Of 672 individuals listed in the studbook by December 2010, 102 were known to be alive (S. G. Stadler in litt. 2012). Since 2006, following an extensive survey of the origin of the founding individuals of the EEP population, major software-based population genetic analyses have been conducted and recommendations for new pairs have been given by the EEP coordinator (S. G. Stadler in litt. 2007, 2012). A special breeding unit for the species has been opened at Marlow Bird Park, Germany (Martínez-Gómez et al. 2003). A proposal has been developed to reintroduce the species (Baptista and Martínez-Gómez 1996, Martínez-Gómez et al. 2003, S. G. Stadler in litt. 2012), along with a restoration programme for Socorro (Martínez-Gómez et al. 2003, Horblit et al. 2006). DNA fingerprinting has revealed extensive hybridisation with Z. macroura in the U.S.A., however it also showed a high degree of relatedness between the European population and pure individuals kept in California (Martínez-Gómez et al. 2003). As a result, the European population will be used for reintroduction efforts. The construction of breeding aviaries on Socorro began in August 2003 (Martínez-Gómez et al. 2003) and was completed by 2005 (Bell et al. 2005a). Resident populations of Z. macroura and Common Ground-dove Columbina passerina (Bell et al. 2005a) were screened in December 2003 and January 2004 to assess the presence of pathogens that might affect the reintroduction programme (Martínez-Gómez et al. 2003, Bell et al. 2005a, b). Avian malaria and trichomoniasis were detected in both species, and as a result recommendations were put forward (Bell et al. 2005a, b). In 2005, plans were outlined to control the locust outbreaks, restore native vegetation and assess the problem of erosion (J. E. Martínez-Gómez in litt. 2005). The arrival on Socorro of the first birds from the EEP was planned for June 2005 (Bell et al. 2005b), with the establishment of a breeding flock by June 2006 (Bell et al. 2005a, S. G. Stadler in litt. 2012). However, there have been problems with import restrictions and permits (J. E. Martínez-Gómez in litt. 2007). In the face of these restrictions a small insurance population was established in the U.S.A. in 2008 (H. Horblit in litt. 2007, J. E. Martínez-Gómez in litt. 2007), forming the basis for the return of the species to Africam Safari Zoo, Puebla, Mexico (S. G. Stadler in litt. 2012). Two groups of birds were transferred to Mexico in 2013 and 2014 to form the basis of a population for eventual reintroduction to Socorro (J. E. Martínez-Gómez in litt. 2016). Control of feral cats has been undertaken on Socorro ( B. Tershy in litt. 1999) although despite over over five hundred cats being killed on the island between 2011-2016, they still persist throughout the island in low numbers (B. Tershy in litt. 2007, J. E. Martínez-Gómez in litt. 2016, Ortíz-Alcaraz et al. 2017, Lowen 2020). Furthermore, over 1,700 feral sheep were culled on the island between 2009-2012 (Ortíz-Alcaraz et al. 2016) and as of 2012, sheep were completely eradicated from the island, facilitating a rapid, remarkable recovery in local vegetation cover (Ortíz-Alcaraz et al. 2017, Lowen 2020). Reports that rats have recently colonised Socorro have proved to be unfounded (J. E. Martínez-Gómez in litt. 1999, 2000) although mice remain an issue on the island and must be removed due to their predation of dove chicks (J. Lowen in litt. 2020). Techniques to grow four endemic tree species from Socorro have been successful, with 117 tree seedlings planted on the island. These restored areas will be important when birds are eventually released back onto Socorro (J. E. Martínez-Gómez in litt. 2016). The species is included on the 'Watch List' of the State of North America's Birds as a species of high conservation concern (NABCI 2016).Conservation Actions ProposedImport birds from the EEP and establish a breeding flock on Socorro (Bell et al. 2005a, b, J. E. Martínez-Gómez in litt. 2007, S. G. Stadler in litt. 2012). Complete the eradication of cats and sheep on Socorro (J. E. Martínez-Gómez in litt. 2005, 2007). Continue to restore native vegetation on Socorro (J. E. Martínez-Gómez in litt. 2005). Reintroduce the species following satisfactory progress in mammal eradication (J. E. Martínez-Gómez in litt. 2005, 2007) and habitat restoration programmes (Martínez-Gómez et al. 2003, Horblit et al. 2006, J. E. Martínez-Gómez in litt. 2005). Put measures in place to control, but not eliminate, the locust swarm (J. E. Martínez-Gómez in litt. 2005, Song et al. 2006).",Neotropical,1972,false,false,Global
181392751,103823595,Hemignathus lucidus,Extinct,,2020,2020-08-10 00:00:00 UTC,3.1,English,"This species was found in O'ahu, Hawaii but it went extinct around the end of the 19th century. Perkins found evidence that many individuals existed in the forests of Oahu in 1860, but no collectors found any trace of it in the 1890s (Munro 1960).","It may have inhabited dense, wet `ohi`a forest and the higher parts of mesic koa-`ohi`a forest (Scott et al. 1986, Pratt et al. 1987).","This species went extinct sometime around the start of the 20th century. Deforestation cleared much lowland habitat. Multiple invasive species were already established on Oahu in the 19th century, with the arrival of Rattus rattus shortly followed by Small Indian Mongoose Herpestes auropunctatus in an attempt at control possibly having the most significant effect on Oahu Nukupu'u. If the species was not already extinct, the arrival of avian pox and avian malaria may have ensured extinction.","The species is extinct. Perkins found evidence that many individuals existed in the forests of Oahu in 1860, but no collectors found any trace of it in the 1890s (Munro 1960).","","Hemignathus lucidus was endemic to O'ahu in the Hawaiian Islands, U.S.A., but it went extinct around the end of the 19th century. Perkins found evidence that many individuals existed in the forests of Oahu in 1860, but no collectors found any trace of it in the 1890s (Munro 1960).","",Terrestrial,"",Oceanian,1899,false,false,Global
192624182,4135,Barbodes pachycheilus,Extinct,,2020,2019-12-31 00:00:00 UTC,3.1,English,"Barbodes pachycheilus was formerly known only from Lake Lanao, Philippines. This species was last recorded in 1964. This has not been recorded from the lake despite various market surveys and fish landing monitoring, as well as direct sampling conducted within the period 1973-2017. Local knowledge from fishermen, fish vendors, and housewives further confirmed the disappearance of this species over the years from Lake Lanao. Therefore, this species is assessed as Extinct. The main driver of extinction was the predatory invasive alien species, Glossogobius giuris (Gobiidae). Another predatory introduced species, Giuris margaritaceus (Eleotridae), translocated accidentally in the lake probably in the early 1970s or much earlier, may have also contributed to its extinction. This species is now the most dominant fish throughout Lake Lanao. Without the eradication of this invasive species, this can push the remaining endemic cyprinids in the lake to extinction. Other significant threats that impacted the survival of this endemic species include overexploitation, rampant use of destructive fishing methods, and unsustainable fishing practices.",This lacustrine species most probably occupied the shallow shores of the lake (Herre 1926).,"The key driver of extinction was the introduction of predatory fish, mainly Glossogobius giuris (Gobiidae) which was accidentally translocated in Lake Lanao in the 1960s probably via stocking of aquaculture fish fry for fisheries enhancement in Lake Lanao (Sanguila et al. 1975, Juliano et al. 1989, Guerrero 2001, P. Escudero pers. comm. 2016). Another invasive alien species, Giuris margaritaceus (Eleotridae), was unintentionally introduced in the lake in the early 1970s or much earlier (Escudero 1995, P. Escudero pers. comm. 2016). This introduced eleotrid has become the most abundant species throughout the lake since 1982. Other threats that drive the endemic species towards extinction are overexploitation, rampant use of destructive fishing methods (i.e., dynamite fishing), unsustainable fishing practices (i.e., indiscriminate harvesting of gravid fish), extraction of water for industrial, agricultural and domestic uses, illegal logging and pollution (Metillo and Garcia-Hansel 2016, Ismail et al. 2014, Naga 2010, Guerrero 2001, Rosagaron 2001, Escudero 1995, Kornfield and Carpenter 1984, Escudero et al. 1980, Sanguila et al. 1975). ","This species was last reported from Lake Lanao in 1964 (Villaluz 1966 in Sanguila et al. 1975). No extant population was recorded from direct sampling, market or fish landing surveys conducted in August- December 1973 (Sanguila et al. 1975), February-December 1974, March-May 1975, June 1976-June 1977 (Escudero et al. 1980), August 1982-July 1983 (Escudero and Demoral 1983), possibly for a year in 1990-1991 (Escudero 1995), November 2000-January 2001 (Ali 2001, possibly also Bacarat 2001), September-October 2001 (Hadji Ali 2002), July-October 2008 (Ismail et al. 2014), and December 2015 (DENR 2015). Monitoring of fish landed catch was recently conducted from May 2016 to March 2017 in major landing sites of the northeastern, southeastern, northwestern, and southwestern parts of the lake but still failed to find this species (Torres 2018). The disappearance and absence of this species in Lake Lanao were further confirmed by local fishermen, fish vendors, and housewives through key informant interviews (Ismail et al. 2014, Torres 2018).","","Barbodes pachycheilus was formerly endemic to Lake Lanao, Mindanao, Philippines. Lake Lanao is the largest lake in Mindanao and the second largest lake in the Philippines. The lake is vital to the whole island of Mindanao. Together with its only outlet (Agus River), Lake Lanao is the major source of hydroelectric power, providing the majority of the electricity needs of Mindanao (Escudero 1995, Rosagaron 2001, Naga 2010, UPLB-DENR 2014). It has a surface area of 357 km2, a maximum depth of 112 m, a mean depth of 60.3 m, a replacement time of 6.5 years, and a lake surface altitude of 702 m (Frey 1969).",There is no existing fishery since this species is now extinct.,Freshwater (=Inland waters),There are no past and ongoing conservation efforts for this species. Any conservation plan for this species is already too late .This species is evidently extinct in Lake Lanao.,Indomalayan,1964,false,false,Global
192624320,12751,Barbodes resimus,Extinct,,2020,2020-01-01 00:00:00 UTC,3.1,English,"Barbodes resinus is listed as Extinct because no individuals have been collected from Lake Lanao and its outlet, the Agus rapids for over 50 years. It was last reported in 1964. Various field sampling, market survey, and fish landing monitoring conducted within the period 1973-2017 failed to find a single individual of this species. The absence of this species in the lake for several decades was confirmed by local fishermen, fish vendors, and housewives through key informant interviews. Predation by introduced fish (mainly Glossogobius giuris), overfishing, unsustainable fishing practices, and destructive fishing methods were key drivers of the extinction of this species. The ichthyofauna of Lake Lanao is now dominated by introduced species, with Giuris margaritaceus (Eleotridae) as the most abundant species throughout the lake. Given this widespread infestation of invasive alien species in Lake Lanao, the survival of this species and all other endemic fishes is unlikely. Research on how to eradicate this invasive species should be given a priority.","This species occurred in Lake Lanao and Agus rapids, the only outlet of Lake Lanao (Herre 1924). Little is known about its biology.","This species is considered Extinct. Extinction of this species is attributed largely to predatory invasive alien fish, Glossogobius giuris (Gobiidae), accidentally introduced in Lake Lanao in the early 1960s.probably via stocking of aquaculture fish fry for fisheries enhancement in Lake Lanao (Sanguila et al. 1975, Juliano et al. 1989, P. Escudero pers. comm. 2016).  Other threats in Lake Lanao and its outlet that contributed to the disappearance of this endemic species include overexploitation, rampant use of destructive fishing methods (i.e., particularly dynamite fishing), unsustainable fishing practices (i.e., indiscriminate harvesting of gravid fish), extraction of water for industrial, agricultural, and domestic uses, illegal logging, and pollution (Torres 2018, Metillo and Garcia-Hansel 2016, Ismail et al. 2014, Naga 2010, Guerrero 2001, Rosagaron 2001, Kornfield and Carpenter 1984, Escudero 1995, Escudero et al. 1980, Sanguila et al. 1975).  Another invasive alien species, Giuris margaritaceus (Eleotridae), was unintentionally introduced in the lake probably in the early 1970s or much earlier (Escudero 1995, P. Escudero pers. comm. 2016). This introduced eleotrid has become the most abundant species throughout the lake since 1982 and may have impacted the survival of this species.","This species was last recorded in 1964 (Villaluz 1966 in Sanguila et al. 1975). No extant population of this species has been found after several surveys conducted in August- December 1973 (Sanguila et al. 1975), February-December 1974, March-May 1975, June 1976-June 1977 (Escudero et al. 1980), August 1982-July 1983 (Escudero and Demoral 1983), most probably for a year in 1990-1991 (Escudero 1995), November 2000-January 2001 (Ali 2001, possibly also Bacarat 2001), September-October 2001 (Hadji Ali 2002), July-October 2008 (Ismail et al. 2014), and December 2015 (DENR 2015). Fish landed catch monitoring from May 2016-March 2017 in major landing sites of the northeastern, southeastern, northwestern, and southwestern parts of the lake also did not find this species (Torres 2018). The disappearance of this species from the lake was further confirmed by local fishermen, fish vendors, and housewives through key informant interviews (Ismail et al. 2014, Torres 2018).","","Barbodes resinus formerly occurred in Lake Lanao and its outlet (Agus rapids), Mindanao, Philippines. Lake Lanao is the largest lake in Mindanao and the second largest lake in the Philippines. The lake is vital to the whole island of Mindanao. Together with its only outlet (Agus River), Lake Lanao is the major source of hydroelectric power, providing the majority of the electricity needs of Mindanao (Escudero 1995, Rosagaron 2001, Naga 2010, UPLB-DENR 2014). It has a surface area of 357 km2, a maximum depth of 112 m, a mean depth of 60.3 m, a replacement time of 6.5 years, and a lake surface altitude of 702 m (Frey 1969).",There is no existing utilization and trading because this species is now extinct.,Freshwater (=Inland waters),Conservation actions are not applicable since the species is now extinct.,Indomalayan,1964,false,false,Global
192624463,15633,Barbodes palaemophagus,Extinct,,2020,2020-01-01 00:00:00 UTC,3.1,English,"Barbodes palaemophagus formerly occurred only in Lake Lanao, Philippines. This species is assessed as Extinct. Its presence in Lake Lanao was last recorded in 1975. Past and recent field sampling, market surveys, and fish landing monitoring conducted within the period 1976-2018 did not detect any individuals of this species. This indicates that the species has not been recorded from the lake for over 40 years. Recent key informant interviews with local fishermen, fish vendors, and housewives confirmed the disappearance or absence for decades of this species in Lake Lanao. The extinction of this species was mainly due to the introduction of predatory fish (Glossogobius giuris, a gobiid accidentally translocated in Lake Lanao in the early 1960s), overfishing, rampant use of destructive fishing methods, and unsustainable fishing practices. Giuris margaritaceus (Eleotridae), another unintentionally introduced fish in the lake in the 1970s, may have also contributed to its extinction. This species is now the most dominant fish throughout Lake Lanao. Without the eradication of this invasive species, this will push the remaining endemic cyprinids in the lake to extinction. ",This lacustrine species most probably inhabited the shallow shores of the lake (Herre 1926).,"Various threats in Lake Lanao led to the disappearance of this species. These include the introduction of predatory fishes (Glossogobius giuris (Gobiidae), unintentionally introduced in the 1960s; eleotrid Giuris margaritaceus (Eleotridae), accidentally translocated in the early 1970s or much earlier), overexploitation, rampant use of destructive fishing methods (i.e., dynamite fishing), unsustainable fishing practices (i.e., indiscriminate harvesting of gravid fish), extraction of water for industrial, agricultural and domestic uses, illegal logging, and pollution (Torres 2018, Metillo and Garcia-Hansel 2016, Ismail et al. 2014, Naga 2010, Guerrero 2001, Rosagaron 2001, Juliano et al. 989, Kornfield and Carpenter 1984, Escudero et al. 1980, Escudero 1995, Sanguila et al. 1975). It is believed that this species was mainly threatened by the predation of invasive alien species (G. giuris), overexploitation, rampant use of destructive fishing methods, and unsustainable fishing practices (Sanguila et al. 1975, Escudero 1995).","There is no extant population that remains in Lake Lanao or elsewhere. This species was last recorded in 1975 (Escudero et al. 1980). This species has not been recorded during market surveys and fish landing monitoring, as well as direct field sampling conducted in June 1976-June 1977 (Escudero et al. 1980), August 1982-July 1983 (Escudero and Demoral 1983), most probably for a year in 1990-1991 (Escudero 1995), November 2000-January 2001 (Ali 2001, possibly also Bacarat 2001), September-October 2001 (Hadji Ali 2002), July-October 2008 (Ismail et al. 2014), and December 2015 (DENR 2015). Monitoring of fish landed catch was conducted from May 2016 to March 2017 in major landing sites of the northeastern, southeastern, northwestern, and southwestern parts of the lake but still no single individual of this species was found (Torres 2018). Local fishermen, fish vendors, and housewives have not encountered this species in the lake and fish markets for decades already based on key informant interviews (Ismail et al. 2014, Torres 2018).","","This species was formerly endemic to Lake Lanao, Mindanao, Philippines. Lake Lanao is the largest lake in Mindanao and the second largest lake in the Philippines. The lake is vital to the whole island of Mindanao. Together with its only outlet (Agus River), Lake Lanao is the major source of hydroelectric power, providing the majority of the electricity needs of Mindanao (Escudero 1995, Rosagaron 2001, Naga 2010, UPLB-DENR 2014). It has a surface area of 357 km2, a maximum depth of 112 m, a mean depth of 60.3 m, a replacement time of 6.5 years, and a lake surface altitude of 702 m (Frey 1969).",No utilization and trading exist because this species is now extinct.,Freshwater (=Inland waters),Conservation of this species comes too late.,Indomalayan,1975,false,false,Global
