assessmentId,internalTaxonId,scientificName,redlistCategory,redlistCriteria,yearPublished,assessmentDate,criteriaVersion,language,rationale,habitat,threats,population,populationTrend,range,useTrade,systems,conservationActions,realm,yearLastSeen,possiblyExtinct,possiblyExtinctInTheWild,scopes
2887512,39158,Flabellidium spinosum,Extinct,,2012,2010-10-19 00:00:00 UTC,3.1,English,This species was collected in 1911 and described in 1916. The forest at the type locality and in the vicinity has been logged and cultivated over the years. We therefore consider that there is no reasonable doubt that the only locality for this species has been destroyed and that the last individual has died.,This species was apparently epiphytic and grew in montane forest.,The forest at the type locality and immediate vicinity has been logged and cultivated over the years.,Probably extinct.,"","Known only from the type collection made in 1911 in Santa Cruz Cordillera of Bolivia. Occurred at 1,400 m.","",Terrestrial,Further surveys are required to see if an extant population of this species can be found.,Neotropical,1911,false,false,Global
3149101,9023,Chelonoidis niger,Extinct,,2017,2017-01-25 00:00:00 UTC,3.1,English,"The species collapsed from an estimated historical population in the early 19th century of about 8,000 animals on Floreana (J.P. Gibbs unpubl. data), to extinction in the wild on Floreana sometime in the mid 1800s. No genetically pure live Floreana Tortoises are known to exist, although a small number of adults held in captivity contain historical Floreana genetic material, with at least one animal at up to 80% niger genome (Poulakakis et al. 2008, Russello et al. 2010, Garrick et al. 2012). Additionally, genetic analyses have identified many tortoises on Wolf Volcano on northern Isabela that have partial Floreana ancestry. Today an estimated 100 to 200 animals with partial Floreana tortoise ancestry remain on Wolf Volcano; so far 84 individuals have been identified from genetic analyses (Garrick et al. 2012). Although no living pure niger animals are confirmed, the possibility exists that some animals on Wolf Volcano may be genetically pure Floreana Tortoises. Overall, in the absence of confirmed genetically pure animals, Chelonoidis niger should continue to be considered Extinct until documented otherwise. ""Chelonoidis nigra ssp. nigra"" was assessed as Extinct in the 1996 IUCN Red List. This assessment incorporates knowledge contributions from the international workshop on Galápagos tortoises convened by the Galápagos National Park Directorate in July 2012.","No specific information on the habitat preferences and ecology of Chelonoidis niger is available; in all likelihood its biology and diet would have been analogous with other saddlebacked Galápagos tortoise species, a morphological adaptation that increases the vertical range of foraging options, from grazing on herbaceous vegetation to browsing on shrubs and cactus during dry periods when low-growing vegetation  is unavailable.","The precise cause of extinction is not exactly known, but most likely involved a combination of direct exploitation by sailors and settlers, as well as the impacts of invasive species. Historically, Cheloniodis niger was exploited as food by sailors provisioning their ships; a settlement was established on the island by 1829 and later converted to a penal colony; pigs, dogs, cats, goats, donkeys, and cattle were introduced around 1832 with the introduction of Black Rats and house mice likely occurred around the same time.","Based on an estimated average density of one tortoise per hectare of suitable habitat, the pre-human population size was estimated to have been about 8,000 adults (J.P. Gibbs unpubl. data). This species was exposed to intense exploitation by whalers in the early 1800s, collecting animals as provisions and to produce oil, with the last large loads of tortoises from Floreana recorded as occurring between 1831 and 1837 (Townsend 1925, Pritchard 1996). Available population information for Chelonoidis niger indicates that the population was not rare during the 1830s, but had collapsed by about 1850 (Pritchard 1996). Charles Darwin saw no live tortoises when he visited in 1835 and only a handful of tortoises appear to have been collected between 1840 and 1847, with final rapid extinction estimated to have occurred in about 1850 (Broom 1929, Steadman 1986). However, several individuals showing hybridization between  C. niger  and  C. becki have recently been discovered on Wolf Volcano on northern Isabela, as well as some with partial ancestry from other islands, including Española and a few from southern Isabela, and some in captivity at the Galápagos National Park’s Tortoise Center on Santa Cruz Island, probably as a result of C. niger being released on Isabela by whalers or other mariners prior to the 1830s (as with C. abingdonii), suggesting that the taxon’s genome may not yet be fully extirpated (Poulakakis et al. 2008, Russello et al. 2010, Garrick et al. 2012, TEWG 2015). These hybrid individuals exhibit strong genetic signatures of Floreana tortoises, as established by genetic analysis of the type specimen, indicating that their ancestry involves C. niger ancestors possibly only one or two generations back.","","Chelonoidis niger occurred on Floreana [formerly Santa María or Charles Island] in the Galápagos Islands of Ecuador. Floreana has a total surface area of 172.5 sq.km, of which ca 81 sq. km (47%) could potentially sustain tortoises (J.P. Gibbs unpubl. data).","This species was exposed to intense exploitation by whalers and other seamen in the 1700s and early 1800s, collecting animals as provisions, with the last large loads of tortoises from Floreana recorded as occurring between 1831 and 1837 (Townsend 1925, Pritchard 1996).",Terrestrial,"Legislation and regulations: Chelonoidis niger is protected under Ecuadorian national law. It has been included in Appendix I of CITES since 1975, prohibiting all forms of commercial international trade. Most of Floreana (98%), and thus the historic range of niger, is protected as part of the Galápagos National Park.Tortoise population restoration on Floreana is currently planned via release of offspring from selectively chosen tortoises with partial Floreana ancestry derived from those identified on Wolf Volcano on Isabela and those in captivity; this complex restoration project was begun in 2015 and will require at least a decade or more for full implementation. A cat and rodent eradication campaign is currently being developed for deployment in the next few years.",Neotropical,ca 1850,false,false,Global
5990668,165210,Viola cryana,Extinct,,2011,2010-07-07 00:00:00 UTC,3.1,English,This French endemic has not been seen since 1927 despite several efforts to find it. It is therefore classed as Extinct.,This herb was found on limestone hills that are facing southwards and are exposed to the sun (Lombard and Bajon 2000).,The causes for the disappearance of the species are supposed to be over-collection by botanists as well as limestone quarrying (Lombard and Bajon 2000).,This species is extinct now but seems to have never been abundant (Lombard and Bajon 2000).,"","This species is endemic to the Bourgogne Yonne Departement, France, where it was detected in 1860 along the Canal de Bourgogne, in the community of Cry, Departement Yonne. The species seems to have disappeared around 1930, its last finding dating to 1927 and it has not been seen since then despite several efforts to search for it (Lombard and Bajon 2000).","",Terrestrial,This species is listed under Appendix I of the Convention on the Conservation of European Wildlife and Natural Habitats (Bern Convention). It has been classed as Extinct under the 1997 IUCN Red List of Threatened Plants (Walter and Gillet 1998). It is also classed as Extinct in the French Red Book of Threatened Plants (Olivier et al. 1995).,Palearctic,1927,false,false,Global & Europe
6955940,173001,Cyclura onchiopsis,Extinct,,2011,2010-09-23 00:00:00 UTC,3.1,English,"No individuals of this iguana have been collected or observed since the middle of the 19th century, despite a number of visits to the island and its occupation during the early 20th century by a resident lighthouse keeper. Schwatrz and Carey (1977) suggested that the introduction of goats and/or cats by the lighthouse keepers might have been responsible for its extinction, but Powell (1999) indicated that exploitation by mine workers on the island during the latter half of the 19th century is a more probable explanation.","Surrounded by cliffs, the portions of Navassa Island presumably capable of supporting iguanas prior to their extinction was characterized by Ekman (1929), Proctor (1959), and paraphrased in Powell (1999). The island is a relatively flat shelf of pot-holed, karstic dolomite covered by sparse, shrubby vegetation (largely the result of 19th century mining operations) with a second, higher plateau with apparently natural savannas as well as areas cleared during the mining operations, interspersed with dense but stunted woodland dominated by four tree species: Short Leaf Fig (Ficus populnea var. brevifolia), False Mastic (Sideroxylon foetidissimum), Pigeon Plum (Coccoloba diversifolia), and Poisonwood (Metopium brownei). Although iguanas probably occurred island-wide prior to their extinction, preferred habitat almost certainly consisted of rocky areas and savannas instead of the densely forested portions of the island. Because Navassa lacks beaches, nesting presumably occurred in pockets of mineralized phosphate that accumulated in potholes. The phosphate (which was commercially extracted during the period when the iguanas presumably became extinct) might have been either of marine or terrestrial origin: precipitates of seawater during periods of submergence or from fish digested by birds and deposited as guano, respectively.Among the five specimens known for this iguana, the maximum snout-vent length is 42 cm for the largest male and 37.8 cm snout-vent length for the largest female (Powell 2000). Based on the morphology of similar species, this is probably far less than the maximum for this iguana.","Like other rock iguanas, the Navassa Rhinoceros Iguana was probably threatened by non-native predators, hunting for human consumption, and non-native competitors which destroyed the vegetation. Schwartz and Carey (1977) suggested that the introduction of goats and/or cats by the lighthouse keepers might have been responsible for its extinction, but Powell (1999) indicated that exploitation by mine workers on the island during the latter half of the 19th century was a more probable explanation.",No individuals have been collected or observed since the middle of the 19th century. The last specimen collection date was July 1878.,"","The Navassa Rhinoceros Iguana was known only from Navassa Island, West Indies, a 5.2 km² island owned by the United States. The iguana presumably occurred island-wide before its extinction.","",Terrestrial,"",Neotropical,July 1878,false,false,Global
8844089,191546,Vernonia sechellensis,Extinct,,2011,2007-02-01 00:00:00 UTC,3.1,English,"Vernonia sechellensis was only recorded once, from Mahé by Horne in 1874. It hasn't been recorded in numerous surveys and collections throughout the 20th century. It is therefore assumed that this species is Extinct. The date of extinction can not be determined. The reason for the extinction of this species is without doubt the extensive clear cutting of Mahé at the beginning of the 20th century, which has lead to the destruction of much of the primary forest.",This species inhabited primary forest on Mahé.,Extensive clear cutting of Mahé at the beginning of the 20th century has destroyed nearly the entire primary forest (Vesey-Fitzgerald 1940).,"This species is thought to be extinct (Friedmann 1994). The date of extinction can not be determined. The reason for the extinction of this species is without doubt the extensive clear cutting of Mahé at the beginning of the 20th century, which led to the destruction of nearly all of primary forest (Vesey-Fitzgerald 1940). Several botanists made collections and surveys in the Seychelles since this species was last collected. The most important were: Schimper 1899, Thomasset 1905, Gardinier 1905 and1908, Vesey-Fitzgerald 1936-39, Jeffrey 1960 -61, Procter 1970, 1972 and1973, Fosberg 1970, Sauer 1967, 1989 Robertson, Friedman 1981-1987, Wise 1985-1990s and Carlström 1994-1996. It is unlikely that Vernonia sechellensis would have been overseen all this years. The details of the several surveys are not known.","",This species was only collected once; on Mahé by Horne 1874 (Baker 1877). It is thought to be extinct (Friedmann 1994).,"",Terrestrial,No conservation actions needed.,Afrotropical,1874,false,false,Global
9544750,30406,Santalum fernandezianum,Extinct,,1998,1998-01-01 00:00:00 UTC,2.3,English,"","","","Last seen in 1908, the species was cut to extinction for its aromatic wood.","","","",Terrestrial,"",Neotropical,,false,false,Global
9706669,32433,Ormosia howii,Extinct,,1998,1998-01-01 00:00:00 UTC,2.3,English,"",It was known to be restricted to montane rainforest.,Exposed to various threats of cutting and encroaching agriculture.,Despite extensive searches the species has not been found again in the two localities where it has been recorded.,"",Only recorded in Dialuo Mt Forest Region on Hainan Island and Yangchun County in Guangdong.,"",Terrestrial,"",Indomalayan,,false,false,Global
9805664,33796,Myrcia skeldingii,Extinct,,1998,1998-01-01 00:00:00 UTC,2.3,English,"","","",No individuals have been seen or recorded since 1972 and the species is presently presumed extinct.,"",A subpopulation was once located in streamside thickets along the Mason River on the Clarendon-St Ann border.,"",Terrestrial,"",Neotropical,,false,false,Global
9966929,35920,Pradosia glaziovii,Extinct,,1998,1998-01-01 00:00:00 UTC,2.3,English,"","","",The area has since been extensively visited and no evidence of the species has been uncovered.,"",Two collections of this species were made in Rio de Janeiro.,"",Terrestrial,"",Neotropical,,false,false,Global
10838671,43993,Vanvoorstia bennettiana,Extinct,,2003,2003-04-30 00:00:00 UTC,3.1,English,"The red alga Vanvoorstia bennettiana has only ever been collected from two sites (in the world). The initial discovery, the type locality, was from the seabed at the eastern end of Spectacle Island in Parramatta River sometime between the 1st and the 16th May in 1855. This site is now operated by the Royal Australian Navy as an explosives storage (barge), administrative offices and a mooring site for destroyers and other large Naval vessels. The shoreline has been altered and strengthened and the seabed is regularly dredged to allow ample draught for large ships. This site was first surveyed by myself and colleague Mr Peter Richards in December 1988. Since then, seven dives during all seasons up until 23 April 2001, have been undertaken at that site. No specimens have been discovered, and the only alga found there was a species of the genus Sargassum, that appears to tolerate low light, high nutrient, regularly disturbed conditions. The only other site known to have harbored this species was on the seabed between Point Piper and Shark Island in Port Jackson (Sydney Harbour). This was collected by Dr Ramsay of the Australian Museum in October 1886. This site was also surveyed by myself and colleague Mr Peter Richards firstly in December 1988 then numerous times (approx 10) since. The seabed in this area now has no solid rocky substrata to which any seaweed could attach, the sediment is approximately 1 m thick (a divers arm disappears to the shoulder) and is easily stirred up by divers and passing ferry traffic. The surrounding rocky foreshore of both Point Piper and Shark Island have only small amounts of the kelp Ecklonia radiata and the green alga Caulerpa filiformis growing on them. Both are known to tolerate heavily disturbed conditions. No specimens of Vanvoorstia bennettiana have been discovered. Within Parramatta River and Port Jackson proper, I have logged some 50 dives from 12 different sites, all of which have reasonable coverage of a few marine algal species typical of the NSW coastline. Based on knowledge of two other species in the genus Vanvoorstia, in addition to known growth strategies and environmental preferences of other genera and species of the red algal family Delesseriaceae, to which Vanvoorstia bennettiana belongs, such areas should harbor this species. In 1913, the then Curator of Algae at the Royal Botanic Gardens Sydney, Arthur Lucas, published a paper in the Proceedings of the Linnaean Society of NSW in which he states ""I have never obtained it [Vanvoorstia bennettiana] either cast up or by dredging."" He was an active collector of algae along the NSW coast up until his death in 1936. The next Curator of Algae was Ms Valerie May who was also an active collector until her retirement in 1988, when I took over the position. She was also unable to rediscover this species. Since 1980, I have logged in excess of 540 dives along the NSW coast as part of a state government research priority to document the entire marine algal flora of the coast. Our collections have come from Cape Howe in the very south of the state, to Cook Island on the Queensland/NSW border, with approximately 100 sites scattered in between. The red algal species Vanvoorstia bennettiana has not been discovered during any of these dives. Several colleagues of mine from the universities of Southern Cross, New England, NSW, Sydney, and Wollongong, plus the Solitary Island Underwater Research Group (SURG), and the operators of every commercial dive shop I have worked through in NSW, have all been briefed on the identification of this and several other rare species of marine algae. None has reported a sighting during the 12 years I have been based at the Royal Botanic Gardens Sydney. The genus is known to have an isomorphic alternation of generations. This means that the haploid male and female macrophytic gametophytes are morphologically identical to the diploid macrophytic tetrasporophytes which they ultimately produce. There is no crustose or resting stage in the life cycle of the species, which may have allowed it to lie dormant for many years until environmental conditions were favourable. In short, both life stages are susceptible to the same environmental parameters. The Extinct category is used 'when there is no reasonable doubt that the last individual has died.' With negative data there can always be some doubt. And new species continue to be found in Australian marine waters, even in Sydney Harbour (J.R. Paxton in litt.). The presence of 15 individuals in one collection indicates that the species was relatively common in at least one portion of Sydney Harbour at that time. Given the isomorphic alternation of generations, it seems most unlikely that the species would remain in existence and remain undetected for more than 100 years. Therefore as no specimens have been seen or collected in the intervening 116 years, despite numerous collections made by algologists in that period, the species can be considered truly Extinct.","Unknown at time of collection in 1855 and 1886. The two sites, and much of Sydney Harbour, presently has soft sediment seabed with scattered rocky reef and rocky intertidal shores. Scattered shells and solid waste products (cans, bottles etc.) also lie on the seabed.","Sydney Harbour is in the middle of the city of Sydney, the largest metropolis in Australia with more than 4 million people. In the 200+ years since settlement, the harbour has been seriously degraded by the population explosion. Use of the harbour as recreational facility, port, source of food, and sewer has seriously impacted on the native flora and fauna. Even by 1880, the harbour was found to be overfished by a Royal Commission. The Major Threats that may have caused the extinction of this alga include large and small scale fisheries particularly trawling, infrastructure development including industry, human settlement, tourism/recreation, water transport [including dredging for ship passage], fisheries- related bycatch by netting, and water pollution from agriculture, domestic, commercial/ industrial, oil, sedimentation, and sewage. The water quality of the harbour has improved since the 1972 passage of the New South Wales Clean Waters Act and the more recent removal of sewage outfalls some kilometers offshore. More fish species have moved to the upper estuarine portions of the Parramatta River and whales have returned to the outer harbour. However, for sessile species of limited distribution like Bennetts seaweed, swimming out of the harbour was not an option and the damage was done, permanently. As we do not even know in which decade the extinction occurred, we will never know which of the major threats was causative; a combination of a number of those listed is likely. [Threats information provided by J.R. Paxton in litt.].","","","First collected/discovered (1855) by crude dredging as a single individual plant from the east end of Spectacle Island, in the Parramatta River, Port Jackson, Sydney Harbour, New South Wales, Australia. Second and last collection (1886) by dredging of approximately 15 individual plants from between Shark Island and Point Piper, Port Jackson, Sydney Harbour, New South Wales, Australia (8 kilometres east of Spectacle Island). Presently unknown.","",Marine,"Listed as a ""Species Presumed Extinct"" in section 4 of Schedule 4 of the Fisheries Management Act 1994, in the state of New South Wales, Australia. Listed as ""Extinct"" under the Environment Protection and Biodiversity Conservation Act 1999, by the Commonwealth of Australia.",Australasian,1886,false,false,Global
12535686,61670,Lysimachia minoricensis,Extinct in the Wild,,2011,2011-07-13 00:00:00 UTC,3.1,English,"Lysimachia minoricensis was only known from a single location (Barranc de Sa Vall), where it disappeared between 1926 and 1950. Fortunately seeds had been collected, and the species was cultivated from 1926 in the Botanical Garden of Barcelona. Although L. minoricensis was believed to be lost when the garden was abandoned during the Civil War, a colony was later rediscovered, growing in the shelter of a bushy thicket. This species is now only found in cultivation and seedbanks. Note that while the species has recently been re-introduced to the wild, it has not yet formed self-sustaining populations.","The only notes made by its discoverer recorded that this herbaceous biennial grew in cool, shady places. This species seems able to produce seeds without pollinators. The number of seeds produced per individual is very high, with up to 3,300 counted for some plants, with an average number of 1,100. Experiments have shown that germination rates are very high, and germination can occur over a wide range of temperature, light, and soil salinity conditions. There is also experimental evidence that this species is well adapted to water stress. The leaves emit a strong odour that may be an adaptation to protect the plant from herbivores.","The reasons for its disappearance in the wild are unknown. It is possible that over-collection and the impact of human activities (such as fire and changes in agricultural practices) may have caused its extinction. On the other hand, it is possible that this species might have benefited from agricultural activities practiced in the past, and that the cessation of these practices may have caused the disappearance of habitat favourable to this species. The most successful re-introduction attempts, where plants survived for up to five years, were in areas previously disturbed by fire, cattle or goats.",This plant is only found in cultivation.,"","Endemic to Menorca in the Balearic Islands, Lysimachia minoricensis was only known from a single location (Barranc de Sa Vall), where it disappeared between 1926 and 1950.","",Terrestrial,"Actions in Place Legally: This species is included in Appendix I of the Bern Convention and listed in the Catalogue of Threatened Species (Catálogo de Especies Amenazadas, CEA). The natural area where it was known from and to where re-introduction attempts have been made (Son Bou i Barranc de Sa Vall) is designated as a Site of Special Natural Interest by the Law 1/1991 of the Parliament of the Balearic Islands. It is also included in the European Natura 2000 network. In situ: Attempts to re-introduce the species into its native habitat have been undertaken since 1959 but have been unsuccessful. The most recent attempts have re-introduced this species with mycorrhizal fungi in the gorges of Sa Vall, Trebaluger, and Algendar. However, the seeds from these individuals have failed to germinate, thus this species is still considered to be Extinct in the Wild. Ex situ: Seeds of this species are conserved in numerous seedbanks. It is also cultivated in several botanical gardens using seeds produced by the original specimens. Actions Needed Most urgently, it is important to understand the reproductive biology of this species, especially the factors that inhibit the germination of seeds in the wild. Second, re-introduction attempts need to be continued. Finally a management plan needs to be developed for the areas where the species has been re-introduced so that the re-introduced populations become self-sustaining.",Palearctic,1926-1950,false,false,"Global, Europe & Mediterranean"
