assessmentId,internalTaxonId,scientificName,redlistCategory,redlistCriteria,yearPublished,assessmentDate,criteriaVersion,language,rationale,habitat,threats,population,populationTrend,range,useTrade,systems,conservationActions,realm,yearLastSeen,possiblyExtinct,possiblyExtinctInTheWild,scopes
67370818,37595,Lachanodes arborea,Extinct in the Wild,,2016,2015-06-13 00:00:00 UTC,3.1,English,"The last wild She Cabbage Trees (Lachanodes arborea) died in 2012. Some cultivated specimens have been replanted in semi-wild situations since the 1980s, but little or no recruitment has been observed except at one site.The species was listed as ‘Critically Endangered C2a(i); D’ by Cairns-Wicks (2003). The transfer of status to ‘Extinct in the Wild’ is the result of the death of the last surviving individuals in the wild.","She Cabbage is a small tree, though it may reach 9 m in height under favourable conditions. Young plants produce very large leaves directly from the main stem, and typically grow extremely quickly; they are capable of reaching 2 m in little over a year. Growth slows at maturity and the tree becomes more branched with much smaller leaves. However, the life cycle is often very short, and many individuals start to display signs of senescence within a decade. Death usually occurs within 20 years.This ephemeral phenology is characteristic of a ‘forest gap colonizer’, and it seems likely that the She Cabbage behaved as one: exploiting short-lived forest clearings, maturing and reproducing before becoming outcompeted by stronger species. Aside from conjecture however, there is no surviving description of the original habitat. Several tree species might have occurred in the mid-altitude belt, but the composition of the woodland around which the ‘gaps’ formed have not been determined.Plants flower sporadically throughout much of the year but more so in the winter months. There is considerable variation in seed viability between individuals which suggests a degree of self-incompatibility, although the mechanism behind this is unknown. The achenes possess a pappus and are dispersed by the wind, but at some sites the majority are consumed by introduced bird species.The unusually soft wood is prone to rapid decay and is host to several species of endemic wood-boring invertebrates. This xylophagous fauna is still poorly-known and its degree of overlap with other hosts is unclear. At least five species of beetle (Coloptera: Curculionidae/Anthribidae) and one moth (Tineidae: Opogona sp.) were present on the Osbourne’s trees and the impact of the loss on this potentially highly endangered micro-fauna is a major concern.","Deforestation was almost certainly the major cause of widespread decline in the She Cabbage. Following the establishment of a permanent colony on St Helena by the East India Company in 1658, the middle altitude zone of the island was rapidly cleared to make way for pasture and the native woodlands were felled for timber and fuel. By the mid 18th Century only small fragments remained, and these had vanished almost entirely by the early 1800s. The soft wood was probably not a major target for felling, but it would have undoubtedly been useful for stoking fires and strong timbers were occasionally used for joists.Deprived of new colonization opportunities, short-lived gap species may be particularly vulnerable to extinction once reduced to small, isolated patches. Indeed, it is unlikely that She Cabbage could persist in the wild on St Helena today without extensive restoration of large tracks of forest to create a viable network of temporary glades. The problems of fragmentation have been further compounded by partial self-incompatibility.The last natural locality at Osbourne’s has not provided particularly suitable habitat for this species since it was discovered. Surrounded on all sides by pasture, plants suffered considerable wind damage due to the lack of a surrounding canopy to shield them. Furthermore, without heavy shade, the understorey had a tendency to become densely in-filled with non-native grasses, which effectively prevented the light wind-blown seed from coming into contact with the ground.","From the 20th Century onwards, very few wild locations have been known. In the 1950s Norman Kerr encountered six individuals in Grape Vine Gut, but when these subsequently died the species was assumed to be extinct. In 1976, George Benjamin discovered a group of three mature trees along a hedge in pasture land near Osbourne’s Spring. With careful management, this colony increased to 35 individuals by 1995, and another site was discovered at Cole’s Rock (Cairns-Wicks, 2003). However, the latter was lost by the late 1990s, and the subpopulation at Osbourne’s dwindled alarmingly: to 7 individuals by 2003, 5 by 2007 and 2 by 2010. The last two survivors succumbed to gales in 2012.A cultivated population has been established from seed collected at Osbourne’s, and there are currently several locations across St Helena where small stands have been planted. The most important are at Mount Pleasant, High Peak Cottage, Cason’s, Osbourne’s and Napoleon’s Tomb. Collectively, these sites contain close to 1,000 individuals.","","The She Cabbage Tree is endemic to St Helena, South Atlantic Ocean. It is no longer found in the wild but survives in cultivation in several places on the island. This distinctive tree appears to have been locally common until the early 19th Century. Roxburgh noted that “in the forests which decorate the south face of Sandy-bay ridge, it grows plentifully” (see Beatson 1816) and Burchell recorded it on the “road from Plantation House to Longwood in moist glens” (see Cronk 2002). This suggests a reasonably broad distribution in sheltered locations across St Helena’s upper mid-altitude zone, perhaps from 600 m to 750 m. As the remaining suitable habitat fragments were lost through progressive deforestation, the few surviving trees became increasingly confined to isolated localities near the species’ upper natural altitudinal limits, often where the range encroached the edges of preserved cloud forest vegetation. However, there is little evidence that this distinctive tree was a regular part of the cloud forest community, and recent plantings on Diana’s Peak Ridge and the windward face of High Peak have not fared particularly well.",Formerly used in building (roofing timbers of old houses like Mount Pleasant).,Terrestrial,"Following agreement on a species action plan (Cairns-Wicks 2007), recovery work has now been sustained for several years. The efforts arrived just in time to avoid total extinction despite the demise of the wild population. Seed collected from Osbourne’s was sourced from several parents and there is no indication of acute inbreeding depression. However, considerable effort is required to maintain seed stocks because the large achenes do not tolerate long-term storage by standard methods and must be sown fresh. In addition, ripe achenes are produced only sporadically and must be collected very quickly before they are dispersed or predated. The fertility of a given plant probably depends on genetic factors relating to the individual and also to the spatial arrangement of potential nearby pollen donors. A number of ‘good seeders’ have emerged amongst the current parental generation, and the resultant increase in productivity has enabled several hundred daughter individuals to be propagated since 2012.The original offspring from Osbourne’s and Grape Vine Gut provenances were planted widely and in small numbers around St Helena’s Central Ridge, but most of these specimens have now died. Such small, dispersed groupings proved to be difficult to tend and less likely to have high fertility. More recent efforts have therefore focused on planting in fewer but larger concentrations. Despite the reasonably healthy state of the recovery programme, the very short generation time of this species ensures that it is still in a very precarious state. The current cohort may not survive much more than a decade, and the risk of extinction remains high unless intensive collection and propagation work is continued.Most of the recently-established She Cabbage plantations are functional seed orchards, designed for convenience. However, the oldest is a private restoration initiative in a semi-natural setting at Mt Pleasant. Here a thriving population has been created amongst mixed stands of endemics, with a graded-age structure. In this favourable habitat, plants naturally self-seed to a moderate degree despite patchy levels of viability, although none of the progeny has yet reached maturity (R. Cairns-Wicks pers. comm. 2014).",Afrotropical,2012,false,false,Global
67371775,37854,Acalypha rubrinervis,Extinct,,2016,2015-06-07 00:00:00 UTC,3.1,English,"The Stringwood (Acalypha rubrinervis) was last recorded between 1855 and 1875, as a single individual transplanted to cultivation at Oakbank. The Central Ridge, which extends for less than 10 kilometres, has now been extensively explored and there is little chance of further individuals remaining undetected.","Stringwood was a monoecious shrub, evidently wind-pollinated, with long male catkins. The solitary female flowers matured into red capsules containing 3 seeds which were moderately large for an Acalypha species and had no obvious means of dispersal, unless by some long-extinct bird species. The few recorded localities appear to have been amongst cloud forest vegetation, dominated by Tree Ferns (Dicksonia arborescens L'Hér) and cabbage trees.","Habitat loss undoubtedly played a major part in the species’ extinction. However, fragments of cloud forest, still supporting a rich endemic flora, persist until the present day, and the reason for the uninhibited decline within these stronghold remain unknown.",Extinct.,"","Stringwood was formerly endemic to the island of St Helena, South Atlantic Ocean, where probably confined to the Central Ridge.Very little is known about the former range of this species. In the 19th Century it was recorded from the Diana’s Peak area, Cason’s and near ‘Round Tower’ (a locality now obscure), though it was undoubtedly already very rare. The named sites suggest a preference for high elevations (700 m  and above) on the Central Ridge, but it is possible that it formerly also extended to lower altitudes where almost complete deforestation had already occurred.","",Terrestrial,"",Afrotropical,1855-1875,false,false,Global
67371983,30560,Trochetiopsis erythroxylon,Extinct in the Wild,,2016,2015-06-16 00:00:00 UTC,3.1,English,"The last wild St Helena Redwood tree (Trochetiopsis erythroxylon) died in the 1950s. Small numbers of cultivated specimens have been replanted in wild situations since the 1980s, but many of these have fared poorly and no recruitment has been observed.","Even the basic ecology of the Redwood is now difficult to reconstruct, presenting a considerable obstacle to further conservation. Roxburgh (see Beatson 1816) reported it to be a “middling-sized tree”. Plants today are slender, rarely exceed 3 m in height and usually do not survive for more than 20 years. It is quite possible that the typical growth form was stronger and more robust in the past, and the hard, red wood once used for construction purposes must have been harvested from much older specimens than those currently known (Cronk 1983). Flowering may occur throughout the year under favourable conditions, and the large, pendent blooms produce copious pollen and nectar. They are visited by a wide range on insects and are also self-fertile. Seed set is usually good but severe predation from mice (Mus musculus) occurs in many places. The seed is moderately large and heavy with no obvious means of dispersal, though it is possible that it was once taken and distributed by forest birds which have long since died-out.","The extinction of the Redwood from natural habitats was, primarily, almost certainly a result of deforestation. Following the establishment of a permanent colony on St Helena by the East India Company in 1659, the middle altitude zone of the island was rapidly cleared to make way for pasture and the forests were felled for timber and fuel. Feral pigs (Sus domesticus), which were then prevalent on the island, were probably responsible for uprooting large numbers of seedlings. By the mid 18th Century only small fragments of the original native woodlands remained, and these had vanished almost entirely by the early 1800s. With the exception of a few preserved stands of Gumwood (Commidendrum robustum (Roxb.) DC.), no descriptions have survived  of the original vegetation of this zone. It is known that Redwood timber was much sought after and the bark was used for tanning.Today, there are considerable challenges in preserving the remaining vestiges of the species. All extant individuals are derived from a single tree. This severe genetic bottleneck appears to have resulted in serious inbreeding depression, with many rearing attempts failing because the plants die as saplings or exhibit severely retarded growth. It is also possible that the Redwood once formed specific mycorrhizal associations which have now been lost, and this could also impair survival. The adults are susceptible to pests and diseases, particularly Vine Weevils (Otiorhynchus sulcatus Fabricius), and seed predation by mice (Mus musculus) is rife at some seed orchards. However, there is considerable variation in vigour between individuals, and small numbers grow into reasonably strong, shrubby trees exceeding two metres in height.","Although a number of trees were present in gardens during the late 19th Century, the cultivated stock appears to have died-out and it is thought that the last wild tree at Peak Dale was the only surviving plant by 1950 (Cronk 2000). All extant specimens are now derived from seed collected from this individual. Cronk guessed that the cultivated population numbered around 60 plants in 2000, and it is likely that the total is approximately the same today.","","The Redwood is endemic to St Helena, South Atlantic Ocean. It is no longer found in the wild but is cultivated in several places on the island.Much uncertainty surrounds the original wild range of the species. Melliss (1875) reported wild trees at High Peak and Diana’s Peak, and since these locations hold the last fragments of indigenous cloud forest, it has often been assumed that the species belonged to this community. However, recent plantings in high altitude locations have not succeeded; repatriated individuals are vulnerable to strong winds and do not thrive in the very damp climate. It may therefore be significant that Melliss reported the plants to be found “in the glens”, perhaps instead suggesting a preference for the sub-montane belt between 550 and 700 m altitude. This zone appears to fit with the last known wild location, below High Peak at the head of Peak Dale Gut. Banks (1896) also asserted that they “refuse the highest ridges” and Roxburgh (see Beatson 1816) noted them “on moderately high hills”. On this assumption, it could be speculated that the range extended over parts of the upper mid-altitude zone of St Helena, particularly in sheltered valleys and on richer soils.","",Terrestrial,"Experiments involving artificial selection have demonstrated that the health of the population can gradually be improved by careful manipulation (Rowe, 1995). Interspecific crosses between T. erythroxylon and the related Dwarf Ebony (Trochetiopsis ebenus Cronk) also produce fertile offspring with greatly increased vigour, and this could offer a possibility to accelerate the removal of deleterious alleles. A limited programme of back-crossing hybrids to T. erythroxylon parents has been conducted by Rebecca Cairns-Wicks. Thus far, F3 plants have been obtained, a few of which display very convincing redwood-like phenotypes, and maintain substantially increased growth rates (R. Cairns-Wicks pers. comm. 2014).However, in order for such efforts to be successful, operations must be long-term and conducted on a much larger scale, as the small numbers of plants currently managed are very prone to accidental losses. In addition, it is important to preserve the genetic material from as many of the older plants as possible to avoid selective processes from further eroding the gene pool. Careful records of all crosses must be maintained so that genetic provenance can be traced.A management plan has been produced (Cairns-Wick 2007), on which the above summary is based, but there are several barriers to achieving the goals. These include a lack of finances, local expertise, facilities and training. Furthermore, the short life cycle of today’s plants requires reasonably intensive efforts to replenish and increase the population. The situation is currently precarious: the ongoing programme is minimal, and periodic loss of trained staff and reallocation of budgets on St Helena could lead to further gaps, with serious consequences. As a safeguard against such problems, some seed has been placed in long-term storage, both on St Helena and at Kew's Millennium Seed Bank in the UK.",Afrotropical,1950s,false,false,Global
67372085,30561,Trochetiopsis melanoxylon,Extinct,,2016,2015-06-17 00:00:00 UTC,3.1,English,"The St Helena Ebony Tree (Trochetiopsis melanoxylon) has been extinct for almost 200 years. Although it is thought to have inhabited the most remote parts of St Helena, the likelihood of this distinctive species remaining undiscovered on a small and well-botanized island is very low.","All known localities occur in areas which are now extremely barren and arid, typically in dry coastal valleys or on screes and hills near the sea, 0 – 200 m altitude. It is somewhat difficult today to understand how a tree species, reputed to develop a trunk up to one metre in diameter, could have thrived in such inhospitable places, especially since most Dombeyoideae species are adapted to reasonably moist habitats. One explanation is that the climate in the lower valleys may have changed substantially around the time of human arrival – a factor which could have contributed to the demise of the species. However, there is no obvious evidence to support this hypothesis. Alternatively, the very dense wood suggests that plants were extremely slow-growing, and this may indicate tolerance of extremely harsh conditions. The small, densely tomentose leaves also display a morphology typically adapted to minimize water loss.","The decline of the Ebony appears to have occurred soon after St Helena was discovered by the Portuguese fleet in 1502. It is highly likely that goat grazing played a major role in the demise. Goats (Capra hircus) were introduced by early ships to provide meat, and rapidly multiplied into large flocks which caused extensive damage to the vegetation of dry areas. A settlement was not established on St Helena until 1659, yet large stands of dead Ebony Trees were discovered in Sandy Bay within 20 years, and were felled soon after to fuel a nearby lime kiln. The exceptionally dense, black wood was potentially very valuable, but it seems likely that many of the remaining trees were carelessly harvested for crude timber or firewood, and the bark stripped as a tanning agent.","The last confirmed record was made by Banks and Solander in 1771 (Banks 1896). Roxburgh reported that a few plants survived until the early 19th Century (see Beatston 1816), though it seems likely that he did not see them personally.","","The Ebony Tree was formerly known from dry lowland valleys and hill slopes of St Helena, South Atlantic Ocean. Very few botanical records were made before the 19th Century when the island had already been severely degraded by deforestation and grazing. We thus know little about the original flora, particularly those species which disappeared during the early phase of human impact. However, since the Ebony Tree was economically important it received occasional mentions in historical documents, and clues to its presence can still be found today in the form of fragments of semi-fossilized wood which still litter some of the drier seaward slopes.From these indications, it appears that the species inhabited lowland areas of St Helena, especially along the south coast. Records have been made from Sandy Bay, Asses’ Ears, Devil’s Hole, Manati Bay, near Egg Island and Horse Pasture. Other possible locations include The Barn, High Knoll and Ebony Plain, but these are subject to potential confusion with the related Dwarf Ebony.",Fragments of ebony wood are still collected today. A few are used in local craft work but most are kept as souvenirs. It seems highly advisable that the removal of these last remaining artefacts should be regulated. The bark was used for tanning.,Terrestrial,"",Afrotropical,1771,false,false,Global
67372241,37598,Nesiota elliptica,Extinct,,2016,2015-06-13 00:00:00 UTC,3.1,English,The St Helena Olive (Nesiota elliptica) is almost certainly Extinct. The population was extremely small for at least 120 years before the final tree died in 1994. Well under 1 km2 of suitable habitat remains along St Helena’s Central Ridge and this has been searched extensively by botanists over recent decades.,"Based on existing evidence, it appears that this species was an inhabitant of cloud forest around St Helena’s highest altitudes (above 750 m). The 20th Century specimen at Mt Actaeon grew in Tree Fern thicket (Cronk 2002), but it is also likely to have occurred in more mixed vegetation with other upland trees on steep slopes below the ridge crest. As the high altitude zone comprises the last vestiges of native forest on St Helena, there remains a possibility that the final individuals were relicts along the upper altitudinal edge of the former range and that the natural distribution would have extended to lower altitudes. However, the Olive certainly seemed to be a regular cloud forest species and a more natural member of this community than other postulated ‘transitional zone’ trees such as Redwood (Trochetiopsis erythroxylon (G.Forst.) Marais) and She Cabbage (Lachanodes arborea (Roxb.) B.Nord.).The flowering period was variable but was probably mainly restricted to the winter months. The small blooms were mainly pollinated by hoverflies, and matured into dry capsules which took up to a year to ripen (Jackson 1991).","The majority of the population was probably lost to deforestation following the establishment of a permanent colony on St Helena by the East India Company in 1658. Trees were cleared for pasture land and also to provide fuel and timber, for which the hard, yellow wood was probably reasonably prized. Only fragments of the original mid-altitude forest cover remained by the mid 18th Century, and by the time of Melliss’s records in the late 1800s there was little native vegetation away from the highest elevations. Further extensive damage was inflicted in the 20th Century when large plantations of New Zealand flax (Phormium tenax J.R.Forst. &amp; G.Forst.) were established over the steep slopes of the Central Ridge, although it appears that the species was already close to extinction by this time.Once severely reduced in numbers, small population size appears to have created further, inherent problems through low self-compatibility and perhaps also through inbreeding depression which may have reduced resilience to pests. It is entirely possible that susceptibility to introduced fungal pathogens may have played a longer term role in the overall demise.","Intact fragments of St Helena Olive habitat probably persisted until the late 1800s, when Solander noted trees up to 30 foot high (approx. 9 m) (see Cronk 2002). A century later, only 12-15 trees remained, and these reputedly attained little more than half the former stature (Melliss 1875). When George Benjamin discovered a single specimen near Mt Actaeon* in 1977 the species had not been seen for many years. This proved to be the last known wild specimen in existence. It died in 1994 but seedlings and a cutting had been propagated from it, and a few cultivated individuals continued the line. Unfortunately these did not survive long, the last succumbing to fungal infections in 2003.(*There is some controversy of the naming of the three summits in the Diana’s Peak range. We here refer to Mt Actaeon as the most northerly in the series.)","","The St Helena Olive formerly occurred in the uplands of St Helena, South Atlantic Ocean. So few specimens survived to the historical period that the original range is difficult to reconstruct. Nearly all old records are from the Diana’s Peak area, although Roxburgh also noted it from “the Sandy Bay range” (see Beatson 1816), presumably meaning that it was more widely distributed along the Central Ridge.","The wood was undoubtedly used for timber, but the harvest is unlikely to have been regular since the mid 19th Century as specimens have become increasingly scarce.",Terrestrial,"After the rediscovery of the single tree in 1977, an intensive rescue attempt was mounted in with expert help from the Royal Botanic Gardens, Kew (Jackson 1991). They found that the species possessed a self-incompatibility breeding system resulting in less than 1% fertility. It consequently proved difficult to raise seedlings, and only one out of hundreds of cuttings was successful. Fungal infections killed the wild tree and blighted attempts to rear plants in cultivation, eventually leading to the death of the last daughter individual.",Afrotropical,2003,false,false,Global
